Title,Stars,DateTime
The Umbrella Academy review – fatuous fisticuffs and inscrutable nonsense,2 out of 5 stars.,2020-07-31T07:00:07+0000
Great Continental Railway Journeys review: potent stuff – and that's just Portillo's trousers,3 out of 5 stars.,2020-07-29T20:00:07+0000
Prodigal Son review – where's Hannibal Lecter when you need him?,3 out of 5 stars.,2020-07-28T21:00:12+0000
Anthony review – reimagining a life cut short by hate,5 out of 5 stars.,2020-07-27T21:00:04+0000
"A Suitable Boy review – a very British, Indian period drama",3 out of 5 stars.,2020-07-26T21:00:34+0000
Miriam Margolyes: Almost Australian review – blunt questions cut to the dark truth of the Australian dream,4 out of 5 stars.,2020-07-24T21:00:36+0000
Love on the Spectrum review – a dating show that celebrates autism,4 out of 5 stars.,2020-07-22T14:00:14+0000
The Rise of the Murdoch Dynasty review – Succession with phone hacking and foam pies,4 out of 5 stars.,2020-07-21T21:00:05+0000
"Enterprice review – a young, black Only Fools and Horses – but weirder",4 out of 5 stars.,2020-07-20T22:15:25+0000
The Young Offenders review – who brings a baby to a robbery?,3 out of 5 stars.,2020-07-19T13:00:51+0000
Celebrity Snoop Dogs review – canine Through The Keyhole is a dog's dinner,1 out of 5 stars.,2020-07-17T20:00:01+0000
Paul O’Grady: For the Love of Dogs review – puppy love blooms in lockdown,3 out of 5 stars.,2020-07-15T20:00:12+0000
The Plot Against America review – fascism grips in taut political allegory,4 out of 5 stars.,2020-07-14T22:20:27+0000
"Once Upon a Time in Iraq review – a gripping, harrowing masterpiece",5 out of 5 stars.,2020-07-13T21:00:31+0000
Imagine: This House Is Full of Music review – is this Britain’s most talented family?,3 out of 5 stars.,2020-07-12T18:00:21+0000
Little Voice review – Apple's music comedy hits a bum note,1 out of 5 stars.,2020-07-10T10:56:23+0000
There She Goes review – sensitive parenting comedy with a spiky edge,4 out of 5 stars.,2020-07-09T21:00:23+0000
P-Valley review – strip club drama is one of the year's best new shows,4 out of 5 stars.,2020-07-09T13:41:05+0000
,,
Mrs America review – Cate Blanchett fights off feminism,4 out of 5 stars.,2020-07-08T21:30:43+0000
"Stateless review – harrowing, hypnotic refugee drama",4 out of 5 stars.,2020-07-08T05:00:02+0000
"The Secrets She Keeps review – yummy mummy thriller is a guilty, predictable pleasure",3 out of 5 stars.,2020-07-06T20:45:12+0000
The Kemps: All True review – Spandau chart-toppers have the last laugh,3 out of 5 stars.,2020-07-05T22:00:54+0000
Celebrity MasterChef review – anyone for a giant lasagne?,3 out of 5 stars.,2020-07-03T20:00:53+0000
"The Baby-Sitters Club review – tween drama is good, old fashioned fun",4 out of 5 stars.,2020-07-03T08:00:16+0000
,,
Welcome to Chechnya review – harrowing tales of the 'gay purge',5 out of 5 stars.,2020-07-01T22:40:34+0000
Ju-On: Origins review – Netflix's gory but scare-free Grudge TV show,2 out of 5 stars.,2020-07-01T12:42:03+0000
Insecure season four review – is this the end of a great screen friendship?,4 out of 5 stars.,2020-06-30T20:35:03+0000
Italy's Frontline: A Doctor's Diary review – a superhero more Beckett than Marvel,4 out of 5 stars.,2020-06-29T21:00:47+0000
A Killer Uncaged review – life after death row,3 out of 5 stars.,2020-06-28T20:45:14+0000
"Dark season three review – a thrilling, brain-scrambling sci-fi finale",4 out of 5 stars.,2020-06-27T05:00:01+0000
Athlete A review – the scandal that rocked the sporting world,4 out of 5 stars.,2020-06-24T12:47:21+0000
Alan Bennett’s Talking Heads review – still a masterclass in storytelling,4 out of 5 stars.,2020-06-23T21:10:00+0000
"Perry Mason review: sleuth reboot is intense, stunning – and gruesome",3 out of 5 stars.,2020-06-22T21:10:27+0000
The Luminaries review – a compulsively complex novel becomes simply addictive TV,4 out of 5 stars.,2020-06-21T21:00:26+0000
The Great review – this imperious Catherine romp reaches for the tsars,4 out of 5 stars.,2020-06-18T08:00:44+0000
"Love, Victor review: more gay teen angst in solid Love, Simon spin-off",3 out of 5 stars.,2020-06-16T07:05:36+0000
College Behind Bars review – how education can unlock prisoners' potential,4 out of 5 stars.,2020-06-15T22:40:26+0000
The Salisbury Poisonings review – Novichok drama with lessons for now,4 out of 5 stars.,2020-06-14T21:00:00+0000
The week in TV: I May Destroy You; Sitting in Limbo; Staged; McMillions; Das Boot - review,Published: ,2020-06-14T08:30:40+0000
The Other One review – class-clash comedy puts the fizz up family life,4 out of 5 stars.,2020-06-12T20:30:02+0000
Hillary review – Clinton swerves the big questions,3 out of 5 stars.,2020-06-11T21:15:03+0000
Staged review – Michael Sheen and David Tennant get meta,3 out of 5 stars.,2020-06-10T22:15:33+0000
Betty review – here's to the skating sisterhood,4 out of 5 stars.,2020-06-09T21:15:02+0000
Murder in the Outback: the Falconio and Lees Mystery review – more tragic than mysterious,3 out of 5 stars.,2020-06-07T21:15:01+0000
Queer Eye season five review – makeover show remains a thing of beauty,4 out of 5 stars.,2020-06-05T10:46:48+0000
"Alex Rider review – slick, silly fun with the teenage James Bond",3 out of 5 stars.,2020-06-04T12:22:51+0000
"Bake Off: The Professionals review – at last, they've got the recipe right!",3 out of 5 stars.,2020-06-02T20:00:19+0000
The week in TV: Unprecedented; A House Through Time; The First Team; Space Force and more,Published: ,2020-05-31T08:30:07+0000
Philharmonia review – Acorn Antiques with subtitles,3 out of 5 stars.,2020-05-31T05:00:03+0000
,,
Space Force review – Steve Carell parody fails to reach orbit,2 out of 5 stars.,2020-05-29T11:30:12+0000
The First Team review – a football sitcom fit for relegation,2 out of 5 stars.,2020-05-28T21:00:41+0000
McMillions review – a rip-roaring romp around the McDonald's Monopoly scandal,3 out of 5 stars.,2020-05-27T22:05:13+0000
"A House Through Time review – an absorbing, important history lesson",4 out of 5 stars.,2020-05-26T21:00:11+0000
Inside the Factory: Keeping Britain Going review – praise be to loo roll!,2 out of 5 stars.,2020-05-25T20:00:00+0000
Snowpiercer review – steampunk Law & Order is a trashy treat,3 out of 5 stars.,2020-05-25T05:00:43+0000
"The week in TV: White Lines, Little Fires Everywhere; Horizon; Becoming",Published: ,2020-05-24T08:30:17+0000
Homecoming season two review – the mystery box that just keeps giving,5 out of 5 stars.,2020-05-22T11:52:00+0000
"What’s the Matter with Tony Slattery? review – a moving study of drink, depression and abuse",4 out of 5 stars.,2020-05-21T21:00:05+0000
"Climbing Blind review – a tale of tenacity, adaptation and hope",3 out of 5 stars.,2020-05-20T21:00:37+0000
A Very British Hotel Chain: Inside Best Western review – too mean by half,2 out of 5 stars.,2020-05-19T21:00:08+0000
Sweet Magnolias review – low-stakes Netflix drama is a syrupy watch,2 out of 5 stars.,2020-05-19T09:04:53+0000
The Big Flower Fight review – floristry Bake Off is a blooming disappointment,2 out of 5 stars.,2020-05-18T11:35:38+0000
Hightown review – Jerry Bruckheimer crime drama is slick but sombre,3 out of 5 stars.,2020-05-17T05:00:51+0000
White Lines review – is it murder on the dancefloor in Netflix's Ibiza mystery?,4 out of 5 stars.,2020-05-15T11:19:56+0000
"The Country That Beat the Virus review – breathtaking, damning and humiliating",4 out of 5 stars.,2020-05-13T21:00:51+0000
The Great review – gleefully garish new series from The Favourite writer,3 out of 5 stars.,2020-05-13T19:54:17+0000
,,
"Return to Real Kashmir FC review – football, fighting and feral dogs",4 out of 5 stars.,2020-05-12T22:00:22+0000
I Know This Much Is True review – Mark Ruffalo's twin performance saves the day,3 out of 5 stars.,2020-05-11T21:10:52+0000
"Dave review – rap comedy sees life imitate art, one penis joke at a time",4 out of 5 stars.,2020-05-10T21:55:36+0000
The Eddy review – dark musical drama needs some jazzing up,3 out of 5 stars.,2020-05-08T11:09:47+0000
"Brassic series two review – lewd, crude ... and totally brilliant",4 out of 5 stars.,2020-05-07T22:00:09+0000
NHS Heroes: Fighting to Save Our Lives review – tearful testimonies from the frontline,4 out of 5 stars.,2020-05-06T21:00:16+0000
The A Word review – autism drama shows the weight of change on us all,4 out of 5 stars.,2020-05-05T21:00:48+0000
Isolation Stories review – powerful snapshots of lockdown life,4 out of 5 stars.,2020-05-04T20:15:17+0000
Homeland finale review – Claire Danes thriller goes out with a bang,4 out of 5 stars.,2020-05-03T21:15:02+0000
The week in TV: Normal People; Blood; Code 404; Hollywood; Museums in Quarantine – review,Published: ,2020-05-03T08:30:48+0000
Trying review – infertility proves fertile ground for laughs,3 out of 5 stars.,2020-05-01T08:00:18+0000
Hollywood review – Ryan Murphy’s Netflix epic is a hollow ode to showbiz,2 out of 5 stars.,2020-05-01T05:00:15+0000
Dispatches from Elsewhere review – Twin Peaks meets Alice in Wonderland,3 out of 5 stars.,2020-04-29T22:05:03+0000
Betty review – female skateboarders cut loose in freewheeling comedy,4 out of 5 stars.,2020-04-29T11:15:14+0000
"Paul Hollywood Eats Japan review – a flimsy, gap year-style food tour",2 out of 5 stars.,2020-04-28T21:00:57+0000
Blood series two review – family thriller still drips with menace,4 out of 5 stars.,2020-04-27T21:05:49+0000
Primates review – monkeying around with Chris Packham,3 out of 5 stars.,2020-04-26T20:15:23+0000
Normal People review – Sally Rooney's love story is a small-screen triumph,5 out of 5 stars.,2020-04-26T05:00:06+0000
,,
Gangs of London review – a thrilling dose of capital punishment,4 out of 5 stars.,2020-04-23T21:45:06+0000
Penny Dreadful: City of Angels review - magnetic but messy escapism,3 out of 5 stars.,2020-04-23T09:10:10+0000
The Truth About Amazon review – a punters' guide to the retail giant's jungle,3 out of 5 stars.,2020-04-21T21:00:26+0000
The Midnight Gospel review – Netflix's new cartoon is a trippy Mr Benn for adults,4 out of 5 stars.,2020-04-20T14:05:12+0000
Cooked With Cannabis review – potty food contest offers a real high,4 out of 5 stars.,2020-04-20T08:00:02+0000
One World: Together at Home review – locked-down stars lift the spirits,Published: ,2020-04-19T17:04:04+0000
Too Hot to Handle review – 'chaste' Love Island is disgustingly bingeable,3 out of 5 stars.,2020-04-17T11:42:36+0000
Home review – designs take on a grander purpose without Kevin McCloud,4 out of 5 stars.,2020-04-17T07:00:07+0000
"Devs review – sci-fi thriller is a dark, wild ride",4 out of 5 stars.,2020-04-15T21:00:25+0000
Prue Leith: Journey with my Daughter review – a fraught search for family secrets,3 out of 5 stars.,2020-04-14T21:00:25+0000
"Quiz review – would you like to ask the audience, Major?",3 out of 5 stars.,2020-04-13T21:00:22+0000
Killing Eve series three review – still deadlier than the rest?,3 out of 5 stars.,2020-04-13T08:00:07+0000
Joe Lycett's Got Your Back review – will the real Hugo Boss please stand up!,3 out of 5 stars.,2020-04-10T20:00:54+0000
Red Dwarf: The Promised Land review – megalomaniac cats are out for revenge,3 out of 5 stars.,2020-04-09T22:00:26+0000
The Countess and the Russian Billionaire review – a fabulously compelling nightmare,3 out of 5 stars.,2020-04-08T21:00:27+0000
"Alma's Not Normal review – this bleak, brilliant comedy is far from ordinary",4 out of 5 stars.,2020-04-07T21:30:07+0000
Malory Towers review – midnight feasts and horrid sneaks make for a ripping Blyton yarn,4 out of 5 stars.,2020-04-06T17:00:02+0000
Models: Street to Catwalk review – all hail the Mancunian mannequins!,4 out of 5 stars.,2020-04-05T08:00:22+0000
Home Before Dark review – can a nine-year-old really solve a murder?,2 out of 5 stars.,2020-04-03T11:00:17+0000
"Gordon, Gino and Fred: American Road Trip review – it's painful, in every sense",2 out of 5 stars.,2020-04-02T21:15:00+0000
Save Me Too review – a gripping thriller with emotional heft,4 out of 5 stars.,2020-04-01T21:00:31+0000
"PEN15 review – boobs, bowl cuts, bullying and other joys of puberty",4 out of 5 stars.,2020-03-31T20:35:02+0000
The Real Michael Jackson review – how did he get away with it for so long?,4 out of 5 stars.,2020-03-30T21:30:34+0000
"Batwoman review – holy cow, Bat-fans, this is heroically bad",2 out of 5 stars.,2020-03-29T21:00:04+0000
Making the Cut review – a fashion show that's already out of style,2 out of 5 stars.,2020-03-27T14:00:00+0000
"Born to Be Different review – a tender look at dating, death and disability",4 out of 5 stars.,2020-03-26T22:00:38+0000
Hitmen review – Mel and Sue swap glazed buns for silenced guns,3 out of 5 stars.,2020-03-25T23:00:11+0000
Putin: A Russian Spy Story review – 'schoolyard thug' who became an unstoppable leader,5 out of 5 stars.,2020-03-23T22:00:14+0000
The Nest review – who's using who in this knotty thriller?,3 out of 5 stars.,2020-03-22T22:00:18+0000
The Letter for the King review – Netflix fantasy epic is low on magic,3 out of 5 stars.,2020-03-20T12:00:39+0000
The English Game review – Julian Fellowes football drama is an own goal,1 out of 5 stars.,2020-03-20T10:18:05+0000
,,
Feel Good – Mae Martin's immaculate romcom will have you head over heels,5 out of 5 stars.,2020-03-18T22:35:36+0000
Penance review – bored with toyboy thrillers? How about some 'incest'!,3 out of 5 stars.,2020-03-17T22:00:06+0000
"Westworld season three review – after the bloodbath, here's the algorithm overlord",3 out of 5 stars.,2020-03-16T22:20:37+0000
Belgravia review – Julian Fellowes is caught in an uptown funk,2 out of 5 stars.,2020-03-15T22:00:08+0000
"100 Humans review – Netflix have your sperm, and they're not afraid to use it",1 out of 5 stars.,2020-03-13T13:46:05+0000
Breeders review – I'm a parent ... get me out of here!,3 out of 5 stars.,2020-03-12T23:05:44+0000
Child of Our Time: Turning 20 review – poignant farewell to Gen Z's Seven Up,4 out of 5 stars.,2020-03-11T22:00:13+0000
"Mrs Fletcher review – come for the milf porn, stay for the messy lives",4 out of 5 stars.,2020-03-10T22:50:45+0000
Miriam’s Big Fat Adventure review – Margolyes chews the fat on obesity,3 out of 5 stars.,2020-03-09T22:00:15+0000
Race Across the World series two review – will this adventure end at the divorce courts?,3 out of 5 stars.,2020-03-08T21:00:45+0000
Amazing Stories review – Spielberg anthology is full of heart,3 out of 5 stars.,2020-03-06T09:00:32+0000
Noughts + Crosses review – reverse-race love story is vital viewing,4 out of 5 stars.,2020-03-05T22:00:19+0000
Zoey's Extraordinary Playlist review – musical dramedy hits all the wrong notes,2 out of 5 stars.,2020-03-04T23:00:51+0000
The Trip to Greece review – Coogan and Brydon have the Midas touch,4 out of 5 stars.,2020-03-03T23:00:25+0000
Liar series two review – from he said/she said hit to lazy thriller,2 out of 5 stars.,2020-03-02T22:00:03+0000
McDonald and Dodds review – mismatched cops are the perfect partners in crime,5 out of 5 stars.,2020-03-01T22:00:26+0000
Restaurants on the Edge review – where's Gordon Ramsay when you need him?,2 out of 5 stars.,2020-02-28T16:11:39+0000
10 Years Younger in 10 Days review – the Botoxed makeover show is back ... and it's uglier than ever,2 out of 5 stars.,2020-02-27T22:00:07+0000
I Am Not Okay With This review – teen angst just got terrifying!,3 out of 5 stars.,2020-02-26T17:30:30+0000
"The Twilight Zone review – a dire, half-hearted reboot",2 out of 5 stars.,2020-02-25T22:00:01+0000
Flesh and Blood review – gorge on this deliciously dread-filled thriller,4 out of 5 stars.,2020-02-24T22:00:32+0000
Intelligence review – never has David Schwimmer been so squandered,2 out of 5 stars.,2020-02-21T22:00:05+0000
Hunters review – Al Pacino's Nazi killer drama is dangerously insensitive,2 out of 5 stars.,2020-02-21T11:33:05+0000
Babies review – all hail the world's smallest superpowers!,3 out of 5 stars.,2020-02-21T06:00:47+0000
Harry Redknapp’s Sandbanks Summer review – utter piffle,1 out of 5 stars.,2020-02-19T20:30:05+0000
How to Stay Out of Jail review – almost miraculously uplifting TV,4 out of 5 stars.,2020-02-18T23:00:39+0000
This Country review – farewell to TV's favourite bumpkins,5 out of 5 stars.,2020-02-17T23:05:10+0000
'Give me death or freedom' – The Battle for Hong Kong review,3 out of 5 stars.,2020-02-16T23:15:41+0000
Visible: Out on Television review – a fabulous history of small-screen gayness,4 out of 5 stars.,2020-02-14T09:00:26+0000
"Work in Progress review – a brave, painful, hilarious queer comedy",4 out of 5 stars.,2020-02-12T22:15:44+0000
The Split series two review – steamy legal saga raises the bar again,4 out of 5 stars.,2020-02-11T22:00:15+0000
The End review – devastating TV that shows what makes life worth living,4 out of 5 stars.,2020-02-10T22:35:47+0000
The Pale Horse review – dread so thick you’ll need a scrub down,4 out of 5 stars.,2020-02-09T22:00:17+0000
"Frankie Boyle's Tour of Scotland review – och aye, it's the new travelogue king!",4 out of 5 stars.,2020-02-07T22:30:20+0000
Locke and Key review – step inside Netflix's house of horrors,4 out of 5 stars.,2020-02-07T17:01:50+0000
,,
Barrymore: The Body in the Pool review – a grim search for answers,3 out of 5 stars.,2020-02-06T22:50:51+0000
The Righteous Gemstones review – if Tony Soprano opened a megachurch,3 out of 5 stars.,2020-02-05T22:15:21+0000
The Pharmacist review – when doctors become drug dealers,4 out of 5 stars.,2020-02-05T17:49:02+0000
"The L Word: Generation Q review – it's here, it's queer ... and it's loads of fun",4 out of 5 stars.,2020-02-04T23:10:54+0000
Baghdad Central review – more than just a Middle East Morse,4 out of 5 stars.,2020-02-03T23:00:24+0000
Beauty Laid Bare review – the ugly secrets in your makeup bag,3 out of 5 stars.,2020-02-02T06:00:35+0000
BoJack Horseman review – what will we do without him?,4 out of 5 stars.,2020-01-31T07:00:38+0000
The Stranger review – was she ever even pregnant?!,3 out of 5 stars.,2020-01-30T16:50:19+0000
Next in Fashion review – Alexa Chung and Tan France's reality show is bang on trend,4 out of 5 stars.,2020-01-29T15:35:23+0000
Belsen: Our Story review – the Nazi horrors that must never be forgotten,5 out of 5 stars.,2020-01-28T22:00:29+0000
The Windermere Children review – how the Lakes saved the lives of Nazi survivors,4 out of 5 stars.,2020-01-27T22:30:01+0000
"Win the Wilderness: Alaska review – someone will get eaten alive here, surely?",3 out of 5 stars.,2020-01-26T22:00:34+0000
Star Trek: Picard review – Patrick Stewart goes guerrilla in skintight velour,3 out of 5 stars.,2020-01-24T09:00:21+0000
The Goop Lab review – so Gwyneth Paltrow doesn’t know what a vagina is,1 out of 5 stars.,2020-01-24T06:00:17+0000
,,
Avenue 5 review – Armando Iannucci's cosmic caper gets utterly lost in space,3 out of 5 stars.,2020-01-22T22:30:37+0000
Crazy Delicious review – foodie TV brought to you by Beelzebub himself,2 out of 5 stars.,2020-01-21T21:00:06+0000
Diamond Dealers and Cockney Geezers review – bling kings don't make for TV gold,2 out of 5 stars.,2020-01-20T23:05:39+0000
Hard Up review – hard-hitting poverty tales the PM ought to hear,4 out of 5 stars.,2020-01-19T10:00:54+0000
Crackerjack! review – superbly silly revival brings magic back to kids’ TV,5 out of 5 stars.,2020-01-17T18:45:06+0000
"Sex Education season two review – fast, funny and still not for the faint-hearted",5 out of 5 stars.,2020-01-17T12:00:05+0000
Little America review – eight immigrant stories make for truly radical TV,4 out of 5 stars.,2020-01-17T07:00:06+0000
Richard Hammond's BIG review – a HUGE hooray for the end of the world!,1 out of 5 stars.,2020-01-15T22:01:14+0000
This Is Our Family review – ordinary lives make for extraordinary TV,4 out of 5 stars.,2020-01-14T23:00:47+0000
The Outsider review – Stephen King slashfest is like CSI on sleeping pills,3 out of 5 stars.,2020-01-13T23:20:18+0000
Deadwater Fell review – it's the new Broadchurch ... but more irresistible,4 out of 5 stars.,2020-01-10T22:00:48+0000
AJ and the Queen review – RuPaul's buddy comedy is a total drag,2 out of 5 stars.,2020-01-10T07:00:30+0000
Cheer review – absolute proof that cheerleaders are gravity-defying gods,4 out of 5 stars.,2020-01-09T15:27:23+0000
White House Farm review – how Jeremy Bamber almost got away with murder,3 out of 5 stars.,2020-01-08T22:00:50+0000
Jonestown: Terror in the Jungle review – the death cult survivors speak out,4 out of 5 stars.,2020-01-07T22:20:10+0000
The Choir: Aylesbury Prison review – Gareth Malone goes behind bars,4 out of 5 stars.,2020-01-06T22:00:41+0000
The Masked Singer review – is that Angela Lansbury singing You Got the Love? If only!,1 out of 5 stars.,2020-01-04T20:31:41+0000
The Deuce final season review – the porn epic everyone should be watching,5 out of 5 stars.,2020-01-02T23:10:46+0000
Dracula review – a blood-sucking delight that leaves you thirsty for more,5 out of 5 stars.,2020-01-01T22:30:16+0000
Doctor Who review – only Jodie Whittaker can save Blighty now!,4 out of 5 stars.,2020-01-01T20:01:13+0000
,,
"The Trial of Christine Keeler review – a furiously fast, fun ride",4 out of 5 stars.,2019-12-30T07:40:23+0000
"Worzel Gummidge review – he's back, he's hilarious and he's wearing a cravat!",5 out of 5 stars.,2019-12-26T19:20:19+0000
Gavin and Stacey Christmas special review – absolutely crackin'!,4 out of 5 stars.,2019-12-25T21:30:52+0000
"Call the Midwife Christmas special review – babies, it’s cold outside!",4 out of 5 stars.,2019-12-25T20:30:51+0000
The Goes Wrong Show review – a terribly brilliant festive farce,4 out of 5 stars.,2019-12-23T20:00:53+0000
A Christmas Carol review – twee-free torment-fest is a tonic for our times,5 out of 5 stars.,2019-12-22T22:00:26+0000
"The Witcher review – swords, sorcerers and supernatural incels",3 out of 5 stars.,2019-12-20T07:00:11+0000
The Cure review – a nightmare drama about the Mid Staffs hospital scandal,3 out of 5 stars.,2019-12-19T22:50:00+0000
Soundtrack review – destined to be a smash hit!,4 out of 5 stars.,2019-12-18T18:00:25+0000
The Brexit Storm Continues: Laura Kuenssberg’s Inside Story review – more manic by the minute,3 out of 5 stars.,2019-12-17T22:00:00+0000
"Responsible Child review – too young to buy a hamster, but tried for murder",4 out of 5 stars.,2019-12-16T22:30:32+0000
"Shrill review – taboo-smashing comedy is a big, fat delight",4 out of 5 stars.,2019-12-15T12:00:51+0000
The Grand Tour review – Clarkson’s banter dads are on a sinking ship,3 out of 5 stars.,2019-12-13T12:14:49+0000
"Buckethead gives Boris the finger, but Johnson gets last laugh – election night TV review",Published: ,2019-12-13T04:27:26+0000
Upright review – Tim Minchin's pitch-perfect Aussie odyssey,4 out of 5 stars.,2019-12-12T23:10:27+0000
The X Factor: The Band review – Cowell's tragic bid to revive a dying show,2 out of 5 stars.,2019-12-11T22:00:49+0000
Angels of the North review – the sassy scissor sisters will snip you now!,4 out of 5 stars.,2019-12-10T16:25:26+0000
The Case of Sally Challen review – inside the trial that changed everything for women,5 out of 5 stars.,2019-12-09T22:30:03+0000
Elizabeth Is Missing review – Glenda Jackson shines in this heartrending whodunnit,5 out of 5 stars.,2019-12-08T22:30:52+0000
"The Tiger Who Came to Tea review – a charming, faithful adaptation",4 out of 5 stars.,2019-12-08T13:36:28+0000
,,
The Marvelous Mrs Maisel season three review – potty-mouthed pizzazz,4 out of 5 stars.,2019-12-06T09:00:37+0000
Truth Be Told review – a criminally bad podcast thriller,2 out of 5 stars.,2019-12-06T06:00:34+0000
Tagged: Life on Lockdown review – inside the brutal world of 'prolific offenders',4 out of 5 stars.,2019-12-04T21:00:53+0000
The Family Secret review – an extraordinary account of child abuse,5 out of 5 stars.,2019-12-03T22:00:33+0000
Growing Up Poor: Britain's Breadline Kids review – the lives stolen by poverty,4 out of 5 stars.,2019-12-02T23:00:05+0000
Seamus Heaney and the Music of What Happens review – this stirring tribute is poetry in motion,4 out of 5 stars.,2019-11-30T23:15:48+0000
Servant review – a decent M Night Shyamalan show? Now there's a twist,3 out of 5 stars.,2019-11-29T06:30:02+0000
Elton John: Uncensored review – 'At my Vegas gig I was peeing into a nappy',3 out of 5 stars.,2019-11-28T22:00:49+0000
"The Baby Has Landed review – where’s the blood, sweat and vomit?!",3 out of 5 stars.,2019-11-27T22:01:20+0000
Meat: A Threat to Our Planet? review – guaranteed to put you off your chicken nuggets,4 out of 5 stars.,2019-11-25T22:00:03+0000
Ladhood review – boisterous comedy smells like teen spirit ... and Lynx,4 out of 5 stars.,2019-11-24T11:00:21+0000
Dolly Parton’s Heartstrings review – country legend sells us a bum steer,1 out of 5 stars.,2019-11-22T06:00:19+0000
Country Music by Ken Burns review – an epic education in American folk,4 out of 5 stars.,2019-11-21T11:31:28+0000
The Nightcrawlers review – are the Filipino authorities executing drug addicts?,4 out of 5 stars.,2019-11-20T22:40:38+0000
"Boom, Bust and Bankers review – a harrowing tale of two Cities",4 out of 5 stars.,2019-11-19T22:00:09+0000
Vienna Blood review – so much like Sherlock it seems like a spoof,3 out of 5 stars.,2019-11-18T22:30:47+0000
"The War of the Worlds review – doom, dystopia and a dash of Downton",4 out of 5 stars.,2019-11-17T22:00:17+0000
Very Ralph review – a flashy designer documentary that's so last season,2 out of 5 stars.,2019-11-15T10:36:22+0000
