Title,Stars,DateTime
Our Planet review – Attenborough's first act as an eco-warrior,4 out of 5 stars.,2019-04-05T05:00:29+0000
Veep review – masterful comedy packed with the darkest of zingers,4 out of 5 stars.,2019-04-03T21:45:01+0000
The Murder of Jill Dando review – a life cut short by senseless brutality,4 out of 5 stars.,2019-04-02T21:00:19+0000
The Case Against Adnan Syed review – Serial should not have been televised,3 out of 5 stars.,2019-04-01T21:01:03+0000
Line of Duty series five review – Jed Mercurio's masterpiece rolls on,5 out of 5 stars.,2019-03-31T21:00:15+0000
Santa Clarita Diet review – this tasty zomcom is back with more bite,4 out of 5 stars.,2019-03-29T06:00:13+0000
The Yorkshire Ripper Files review – a stunningly mishandled manhunt,4 out of 5 stars.,2019-03-27T13:00:16+0000
Road to Brexit review – thanks for trying to joke us through this hell,2 out of 5 stars.,2019-03-26T22:30:37+0000
Art 50: The Sound of Britain review – can art stop the Brexit madness?,3 out of 5 stars.,2019-03-25T22:30:06+0000
Victoria series three review – sit back and enjoy the soapy ride,3 out of 5 stars.,2019-03-24T22:00:00+0000
The OA season two review – the psychic octopus is the final straw,2 out of 5 stars.,2019-03-22T06:30:31+0000
Pose review – a show to fall head-over-heels in love with,5 out of 5 stars.,2019-03-21T22:16:20+0000
Stabbed: Britain's Knife Crime Crisis review – a portrait of an emergency,4 out of 5 stars.,2019-03-21T22:00:19+0000
,,
"The Bay review – Broadchurch in Morecambe? Come on in, the water's lovely",4 out of 5 stars.,2019-03-20T22:00:12+0000
Skeletons of the Mary Rose review – how multicultural was Tudor England?,4 out of 5 stars.,2019-03-17T21:00:18+0000
One Red Nose Day and a Wedding review – Is it still funny? I hadn't noticed,3 out of 5 stars.,2019-03-15T23:26:44+0000
The Disappearance of Madeleine McCann review – a moral failure,1 out of 5 stars.,2019-03-15T13:44:48+0000
60 Days on the Streets review – truly revelatory TV that damns us all,4 out of 5 stars.,2019-03-14T22:00:10+0000
"American Gods series two review – a shonky Game of Thrones, minus the dragons",2 out of 5 stars.,2019-03-13T15:34:16+0000
The Kennedy Who Changed the World review – if only she'd been president,3 out of 5 stars.,2019-03-13T06:00:12+0000
"Cheat review – a chilling drama, perfect for a cold snap",3 out of 5 stars.,2019-03-11T22:00:23+0000
Arcadia review – a beautifully bonkers montage of Britain's rural past,4 out of 5 stars.,2019-03-10T22:20:08+0000
Deutschland 86 review – bazookas and shoulder pads at the ready!,3 out of 5 stars.,2019-03-08T22:00:10+0000
Travelling Blind review – a touching journey that leaves tweeness at home,4 out of 5 stars.,2019-03-07T21:00:26+0000
Leaving Neverland review – astonishing accounts of Michael Jackson's sexual abuse,4 out of 5 stars.,2019-03-06T22:50:00+0000
"MotherFatherSon review – completely cuckoo, utterly irresistible",3 out of 5 stars.,2019-03-06T22:00:06+0000
,,
Home review – Syrian refugee sitcom struggles to spin comedy gold,3 out of 5 stars.,2019-03-05T22:15:01+0000
"Derry Girls series two review – still magic, still a total ride",5 out of 5 stars.,2019-03-05T21:45:00+0000
Fleabag series two review – she's back ... and she's taking aim at God,5 out of 5 stars.,2019-03-04T23:00:35+0000
Louis Theroux: The Night in Question review – an incendiary look at campus rape,3 out of 5 stars.,2019-03-04T22:00:36+0000
Ice Age: Return of the Mammoth review – meet the scientist with ominous plans for his frozen carcasses,4 out of 5 stars.,2019-03-03T21:00:13+0000
"Soft Cell: Say Hello, Wave Goodbye review – uh oh, tainted doc",2 out of 5 stars.,2019-03-01T22:00:17+0000
In the Line of Fire with Ross Kemp review – nothing but flashbangery,3 out of 5 stars.,2019-02-28T22:00:46+0000
The Satanic Verses: 30 Years On review – what an astonishing fallout,4 out of 5 stars.,2019-02-27T22:00:36+0000
"Bowls: Top Crown on BBC Two - archive, 1975",Published: ,2019-02-27T05:30:36+0000
Safe at Last: Inside a Women's Refuge review – there are wolves at every door,5 out of 5 stars.,2019-02-26T23:30:29+0000
Long Lost Family Special: Born Without Trace review – my heart hurts,4 out of 5 stars.,2019-02-25T22:30:07+0000
This Time With Alan Partridge review – an excruciating white-knuckle ride,5 out of 5 stars.,2019-02-25T22:00:07+0000
Jerk review: Tim Renkow has created a Larry David for a new generation,4 out of 5 stars.,2019-02-24T13:00:25+0000
Curfew review – Sean Bean races into a diesel-fuelled zombie apocalypse,3 out of 5 stars.,2019-02-22T22:00:37+0000
Sleeping With the Far Right review – could you move in with a man too racist for Ukip?,Published: ,2019-02-21T22:01:06+0000
The Fifteen Billion Pound Railway review – digging into the Crossrail catastrophe,3 out of 5 stars.,2019-02-20T22:00:39+0000
100 Vaginas review – an extraordinary and empowering spread of the legs,5 out of 5 stars.,2019-02-19T23:00:21+0000
Growing Up Gifted review – moments of hope amid the classism and cruelty,4 out of 5 stars.,2019-02-18T22:00:52+0000
Baptiste review – the return of The Missing’s grizzled detective lacks something,3 out of 5 stars.,2019-02-17T22:00:08+0000
The Umbrella Academy review – get ready for a downpour of hokum,2 out of 5 stars.,2019-02-15T11:00:42+0000
David Bowie: Finding Fame review – a pretty tough watch for fans,4 out of 5 stars.,2019-02-09T23:17:18+0000
Front Row Late review – 40 minutes of Mary Beard and Philip Pullman agreeing,3 out of 5 stars.,2019-02-09T06:30:10+0000
,,
Ryanair: Britain's Most Hated Airline? review – tales of horror and stinginess,3 out of 5 stars.,2019-02-07T22:00:21+0000
"Das Boot review – a claustrophobic, clever and utterly thrilling reboot",4 out of 5 stars.,2019-02-06T23:25:04+0000
Surviving R Kelly review – disturbing but deeply flawed,3 out of 5 stars.,2019-02-06T00:00:23+0000
How the Other Kids Live: the most pleasant show of the year is here,Published: ,2019-02-05T10:08:40+0000
Teachers Training to Kill review – the fight to arm elementary schools,4 out of 5 stars.,2019-02-04T22:15:40+0000
Hanna review – this TV show will self-destruct in 24 hours!,3 out of 5 stars.,2019-02-04T11:10:07+0000
"Africa with Ade Adepitan review – at last, a diverse BBC travel show",3 out of 5 stars.,2019-02-03T22:00:11+0000
Russian Doll review – layer upon layer of dead-good TV comedy,4 out of 5 stars.,2019-02-01T11:00:49+0000
Camping review – Lena Dunham's remake lacks Julia Davis's evil genius,2 out of 5 stars.,2019-01-31T23:10:34+0000
Pure review – a masterly comedy about sex and mental health,4 out of 5 stars.,2019-01-30T22:45:04+0000
"Icons review – Hitchcock v Warhol in a fun, gimmicky battle of 20th-century titans",3 out of 5 stars.,2019-01-29T22:00:15+0000
The Last Survivors review – an extraordinary memorial to children of the Holocaust,5 out of 5 stars.,2019-01-27T22:32:45+0000
"Unbreakable Kimmy Schmidt review – weird, messy and funny to the very end",4 out of 5 stars.,2019-01-25T13:00:37+0000
"Conversations With a Killer: The Ted Bundy Tapes review – harrowing, but pointlessly so",2 out of 5 stars.,2019-01-24T16:00:10+0000
Danny Dyer’s Right Royal Family review – let's get regalled out of our brains!,3 out of 5 stars.,2019-01-23T22:01:48+0000
"Escape at Dannemora review – a big, cinematic series with a cast to match",3 out of 5 stars.,2019-01-22T22:10:30+0000
A Year of British Murder review – a coldly mechanical collage of 768 tragic deaths,3 out of 5 stars.,2019-01-21T23:00:00+0000
Black Lake review – Love Island but with a hellmouth in the bedroom,3 out of 5 stars.,2019-01-19T22:30:03+0000
The Grand Tour review – Clarkson and co skid ever further into irrelevance,2 out of 5 stars.,2019-01-18T09:00:14+0000
American History’s Biggest Fibs review — Trump would put Lucy Worsley up against the wall,4 out of 5 stars.,2019-01-17T22:00:00+0000
"Revolution in Ruins: The Hugo Chávez Story review – essential, chilling viewing",4 out of 5 stars.,2019-01-16T22:00:04+0000
The Passage review – a vampire drama to sink your teeth into,4 out of 5 stars.,2019-01-15T22:00:04+0000
True Detective review – sufficiently gripping despite the mumbling,3 out of 5 stars.,2019-01-14T23:20:35+0000
Is This Sexual Harassment? review – an object lesson in subjectivity,3 out of 5 stars.,2019-01-13T17:00:13+0000
Sex Education review – a horny teen comedy … and so much more,4 out of 5 stars.,2019-01-11T08:00:05+0000
Flirty Dancing review – a silly dating show waltzing its way into our TV favourites,3 out of 5 stars.,2019-01-10T22:55:12+0000
Cleaning Up review: Sheridan Smith’s stock keeps on rising,3 out of 5 stars.,2019-01-09T22:00:24+0000
"Catastrophe, season four review – still superbly vicious, and a little more silly",4 out of 5 stars.,2019-01-08T22:31:10+0000
"Brexit: The Uncivil War review – superficial, irresponsible TV",2 out of 5 stars.,2019-01-07T23:05:26+0000
The Babes in the Wood Murders review – the closing chapter of a shocking cold case,4 out of 5 stars.,2019-01-07T22:00:24+0000
,,
"Manhunt review – a sober, responsible drama about the murder of three young females by Levi Bellfield",3 out of 5 stars.,2019-01-06T22:00:11+0000
Tidying Up With Marie Kondo review – TV destined for the bin bag of shame,2 out of 5 stars.,2019-01-04T09:00:08+0000
Back in Time for School review – alarmingly relevant lessons in empire,4 out of 5 stars.,2019-01-03T21:01:27+0000
Waco: Madman or Messiah? review – the remarkable story of a hellish cult,4 out of 5 stars.,2019-01-02T22:30:00+0000
"Luther review – the maverick, the minion and the pincushion",3 out of 5 stars.,2019-01-01T22:00:12+0000
Black Mirror: Bandersnatch review – the TV of tomorrow is now here,4 out of 5 stars.,2019-01-01T11:53:05+0000
,,
"Raymond Briggs: Snowmen, Bogeymen & Milkmen review – a timely look at an eccentric life",4 out of 5 stars.,2018-12-31T22:00:01+0000
"Les Misérables review – merci, Andrew Davies, c'est magnifique",4 out of 5 stars.,2018-12-30T22:00:10+0000
Billy Connolly: Made in Scotland review – pure gallus from a folk comedy hero,5 out of 5 stars.,2018-12-28T22:01:03+0000
Morecambe & Wise in America review – Eric and Ern are back! What a joy,4 out of 5 stars.,2018-12-27T21:00:04+0000
The ABC Murders review – John Malkovich’s suffering Poirot is magnificent,4 out of 5 stars.,2018-12-26T22:00:05+0000
Torvill and Dean review – another perfect 6.0 for Britain's favourite skating duo,5 out of 5 stars.,2018-12-25T23:15:08+0000
Call the Midwife review – the sisters tackle Brexit,4 out of 5 stars.,2018-12-25T21:15:05+0000
Watership Down review – CGI rabbits can't save this Christmas turkey,2 out of 5 stars.,2018-12-23T21:00:08+0000
When Mary Beard Met Clive James review – curious minds rage against the dying of the light,4 out of 5 stars.,2018-12-21T23:35:12+0000
"Bear’s Mission With Gareth Southgate review – comfort TV, if you don’t have vertigo",3 out of 5 stars.,2018-12-20T22:00:10+0000
"The World’s Most Extraordinary Christmas Dinners review – hark! The £150,000 cracker",3 out of 5 stars.,2018-12-19T22:00:12+0000
"The Long Song review – a sharp, painful look at the last days of slavery",4 out of 5 stars.,2018-12-18T22:00:12+0000
"24 Hours in A&E review – trauma, tears and triage in real-life Casualty",3 out of 5 stars.,2018-12-17T21:59:37+0000
The Apprentice: Finale review – surely time to dismantle this panto?,2 out of 5 stars.,2018-12-16T22:00:51+0000
"The 10 best Australian TV shows of 2018: a picnic, rush hour and outback noir",Published: ,2018-12-16T17:00:45+0000
Billy Connolly’s Ultimate World Tour review – a reflective reminder of his brilliance,3 out of 5 stars.,2018-12-13T22:00:25+0000
Jonathan Pie’s American Pie review – viral ranter takes a sub-Theroux US road trip,2 out of 5 stars.,2018-12-13T06:00:09+0000
Counterpart: season two review – the superlative spy thriller returns,4 out of 5 stars.,2018-12-12T06:00:38+0000
Sir Cliff: 60 Years in Public and Private review – an honest account of his troubling time,2 out of 5 stars.,2018-12-10T22:00:12+0000
Care review – Sheridan Smith excels in delicately observed drama,4 out of 5 stars.,2018-12-09T22:30:27+0000
The Marvelous Mrs Maisel review – standup sitcom it's a pleasure to sit down for,5 out of 5 stars.,2018-12-07T06:00:13+0000
Escape From Dubai: The Mystery of the Missing Princess review – a shocking tale of complicity and betrayal,5 out of 5 stars.,2018-12-06T22:00:00+0000
"Vic & Bob’s Big Night Out review – don’t analyse, just marvel as it takes flight",3 out of 5 stars.,2018-12-05T22:30:14+0000
Lockerbie: The Unheard Voices review – the profound suffering endures,3 out of 5 stars.,2018-12-04T22:30:08+0000
Nadiya’s Asian Odyssey review – ‘I think I just got blessed by accident!’,4 out of 5 stars.,2018-12-03T21:58:14+0000
Gun No 6 review – a magisterial portrait of the misery wreaked by a single firearm,4 out of 5 stars.,2018-12-02T22:10:03+0000
Ministry of Justice review – pranksters line up easy targets,3 out of 5 stars.,2018-12-01T06:00:15+0000
Kidding review – Jim Carrey’s schmaltzy vehicle made me reach for the sick bag,2 out of 5 stars.,2018-11-30T07:00:28+0000
Death and Nightingales review – chilling viewing for dark winter evenings,3 out of 5 stars.,2018-11-28T22:00:03+0000
Mrs Wilson review – a compellingly sinister howdunnit,3 out of 5 stars.,2018-11-27T22:00:19+0000
"Babies: Their Wonderful World review – cute, but totally unscientific",2 out of 5 stars.,2018-11-26T22:00:49+0000
A Great British Injustice: The Maguire Story review – a harrowing tale,4 out of 5 stars.,2018-11-25T23:00:20+0000
Britain By Boat: 2 Grumpy Sailors review – newsmen run aground,1 out of 5 stars.,2018-11-23T21:00:19+0000
"The Kominsky Method review – Michael Douglas in patchy, poignant portrait of male friendship",3 out of 5 stars.,2018-11-23T06:00:05+0000
,,
The Contraceptive Pill: How Safe Is It? review – a welcome antidote to the scare stories,3 out of 5 stars.,2018-11-21T22:00:21+0000
"The Final Table review – big, bombastic and barely watchable",2 out of 5 stars.,2018-11-21T06:00:24+0000
My Brilliant Friend review – a beautiful adaptation of Elena Ferrante’s tale,4 out of 5 stars.,2018-11-19T22:05:40+0000
The Interrogation of Tony Martin review: a chilling portrait of self-righteousness,3 out of 5 stars.,2018-11-18T22:00:12+0000
Narcos: Mexico review – Netflix's druglord saga sticks to its winning formula,4 out of 5 stars.,2018-11-16T06:00:55+0000
Inside the Foreign Office review – Brexit and diplomacy don’t make for thrilling TV,2 out of 5 stars.,2018-11-15T22:00:45+0000
Patriot: season two review – complex spy caper gets lost in its own smugness,3 out of 5 stars.,2018-11-15T06:00:26+0000
,,
Stacey Dooley: The Young and Homeless review – a perilous tale of life on the streets,3 out of 5 stars.,2018-11-13T23:45:00+0000
People Just Do Nothing review – Kurupt FM's original pirate material,5 out of 5 stars.,2018-11-12T22:00:25+0000
Dynasties review: A leader called David who is ever fearful of a coup – remind you of anything?,3 out of 5 stars.,2018-11-11T21:30:19+0000
Alone at Home review – teenage brats prove strangely tough hate figures,2 out of 5 stars.,2018-11-10T06:00:36+0000
"Westside review – Netflix's own Fame, minus the legwarmers or the charm",2 out of 5 stars.,2018-11-09T06:00:09+0000
Killer By the Lake review – a picturesque procedural for those craving more Spiral,3 out of 5 stars.,2018-11-08T06:00:07+0000
Wednesday’s best TV: Killer By the Lake; Trust; Dark Heart,Published: ,2018-11-07T06:19:25+0000
School review – education that’s creaking under the strain of reform,4 out of 5 stars.,2018-11-06T22:00:15+0000
Doing Money review – bleak and unforgiving story of modern slavery,3 out of 5 stars.,2018-11-05T22:30:14+0000
Altered States: Love Without Limits review – Louis Theroux treads his tightrope,3 out of 5 stars.,2018-11-04T22:00:40+0000
House of Cards: season six review – we still need to talk about Kevin,2 out of 5 stars.,2018-11-02T07:00:24+0000
The First review – Sean Penn's Mars drama fails to launch,2 out of 5 stars.,2018-11-01T22:00:13+0000
The Secret Story of Stuff review – inventions provoke awe and wonder – and hope,3 out of 5 stars.,2018-10-31T22:00:43+0000
The Fires That Foretold Grenfell review – five missed chances to stop a tragedy,4 out of 5 stars.,2018-10-30T22:00:27+0000
Black Earth Rising finale review – slick Rwandan drama signs off in style,5 out of 5 stars.,2018-10-30T06:00:10+0000
Jane Fonda in Five Acts review – an unsatisfying portrait of a complex superstar,2 out of 5 stars.,2018-10-29T06:00:07+0000
Chilling Adventures of Sabrina review – where has the magic gone?,3 out of 5 stars.,2018-10-27T05:00:12+0000
Sally4Ever review – Julia Davis unleashes another comic monster,4 out of 5 stars.,2018-10-25T21:30:30+0000
Luisa Omielan’s Politics for Bitches review – a truly refreshing voice,4 out of 5 stars.,2018-10-24T22:45:22+0000
A Dangerous Dynasty: House of Assad review – the making of a murderous tyrant,5 out of 5 stars.,2018-10-23T21:00:25+0000
My Dinner with Hervé review – a glorious and tragic romp in 90s Lalaland,4 out of 5 stars.,2018-10-22T21:30:01+0000
The Cry finale review – a fitting end to this sickeningly addictive thriller,3 out of 5 stars.,2018-10-21T21:05:12+0000
Making a Murderer: Part 2 review – Netflix's grisly mystery continues to enthral,3 out of 5 stars.,2018-10-18T23:01:07+0000
Child of Mine review – three stories that reveal the tragedy of stillbirth,4 out of 5 stars.,2018-10-18T22:25:06+0000
"How to Get a Good Night’s Sleep review – cures insomnia, not in the way they intended",2 out of 5 stars.,2018-10-18T07:16:11+0000
,,
Informer review – counter terror drama is gripping and artful … but you’ll need to pay attention,4 out of 5 stars.,2018-10-16T21:00:20+0000
"Barneys, Books and Bust Ups: 50 Years of the Booker Prize review – a hilarious jaunt",3 out of 5 stars.,2018-10-15T21:00:08+0000
"Butterfly review – an important, truthful drama about a transgender child",4 out of 5 stars.,2018-10-14T21:00:14+0000
The Romanoffs review – Matt Weiner's Mad Men follow-up is a family saga gone awry,2 out of 5 stars.,2018-10-12T08:00:24+0000
Women on the Verge review – a scabrous creation from Sharon Horgan that doesn’t quite hit the peaks,3 out of 5 stars.,2018-10-11T21:40:12+0000
The Bisexual review – a comedy-drama that is neither funny nor dramatic,2 out of 5 stars.,2018-10-10T21:40:06+0000
"Wanderlust finale review – overly theatrical, but unashamedly tender",3 out of 5 stars.,2018-10-09T21:00:29+0000
Old People’s Home for 4 Year Olds review – walks a fine line between heart and sentimentality,4 out of 5 stars.,2018-10-08T21:00:16+0000
"Vanity Fair review – lavish, lively, intelligent and funny, never moving at less than a full gallop",4 out of 5 stars.,2018-10-07T21:10:01+0000
The Big Audition review – at last … reality TV without the sneering,3 out of 5 stars.,2018-10-05T21:00:04+0000
"Rich House, Poor House review – an overly reassuring tale of the Haves and Have Nots",2 out of 5 stars.,2018-10-04T22:00:00+0000
Sorry for Your Loss – Facebook's rough and granular journey through grief,4 out of 5 stars.,2018-10-04T06:00:15+0000
The Bank That Almost Broke Britain review – 10 years since the brink of disaster,3 out of 5 stars.,2018-10-02T21:00:35+0000
"Drowning in Plastic review – a rallying cry to ditch plastic, but is it too late?",4 out of 5 stars.,2018-10-01T21:02:06+0000
The Cry review – a baby-snatching drama to rival Bodyguard,4 out of 5 stars.,2018-09-30T21:00:04+0000
The Good Place season 3 review – a fiendishly smart sitcom salvation,4 out of 5 stars.,2018-09-28T05:00:49+0000
Sick of It review – Karl Pilkington’s new comedy is more melancholy meditation than shaggy dog stories,3 out of 5 stars.,2018-09-27T22:04:38+0000
Alex review – a pitch-black thriller with a hero so dark it’s hard not to like him,3 out of 5 stars.,2018-09-26T23:05:04+0000
,,
The Flu That Killed 50 Million review – could the deadly pandemic have been avoided? ,4 out of 5 stars.,2018-09-25T21:00:00+0000
Oceans Apart: Art and the Pacific with James Fox review – an engaging exploration of Māori culture,3 out of 5 stars.,2018-09-24T21:00:03+0000
BoJack Horseman: season 5 review – pathos and punchlines make this a Netflix showstopper,5 out of 5 stars.,2018-09-24T05:00:12+0000
"Bodyguard recap: series one, episode six – the finale",Published: ,2018-09-23T21:15:02+0000
Michael Palin in North Korea review – a soothing look at a despotic regime,3 out of 5 stars.,2018-09-21T09:32:45+0000
Friday’s best TV – Can You Feel It: How Dance Music Conquered the World,Published: ,2018-09-21T05:20:17+0000
Maniac review – Jonah Hill and Emma Stone hit career highs in NYC dystopia,4 out of 5 stars.,2018-09-21T05:00:17+0000
Grand Designs review: Kevin McCloud standing in front of a tiny castle? I smell trouble …,3 out of 5 stars.,2018-09-19T21:01:06+0000
Shot By My Neighbour review – a bold investigation into bloody punishment in Northern Ireland,4 out of 5 stars.,2018-09-18T22:45:02+0000
"Monkman and Seagull’s Genius Guide To Britain review – nice enough, but where's the brainy swagger?",3 out of 5 stars.,2018-09-17T19:31:03+0000
"Killing Eve review – comedy, tragedy and thrills, this spy series has it all",5 out of 5 stars.,2018-09-15T21:00:06+0000
A Discovery of Witches review – a bubbling cauldron of fantasy cliches,3 out of 5 stars.,2018-09-15T05:30:46+0000
The Mighty Redcar review – proper heartwarming film-making,5 out of 5 stars.,2018-09-13T20:45:03+0000
Trust review: Danny Boyle’s Getty drama looks lavish but lacks depth,3 out of 5 stars.,2018-09-12T21:00:00+0000
"The Deuce: season two review – punk, disco and second-wave feminism have arrived",4 out of 5 stars.,2018-09-12T05:00:07+0000
,,
Strangers review – John Simm impresses in intriguing Hong Kong thriller,3 out of 5 stars.,2018-09-11T09:18:10+0000
"No Activity review – nothing happens, but that’s the point of this hilarious cop comedy",4 out of 5 stars.,2018-09-09T22:20:07+0000
The Luke McQueen Pilots review – a presenter on the verge of a breakdown,2 out of 5 stars.,2018-09-08T05:30:17+0000
"Press review – an old-fashioned view of journalism, but an entertaining one",3 out of 5 stars.,2018-09-06T21:00:20+0000
"DIY SOS: Grenfell Boxing Club review – their biggest, most important build yet",3 out of 5 stars.,2018-09-05T21:00:14+0000
Wanderlust review – the steamiest show on TV? Let’s just say there are some exciting new possibilities,3 out of 5 stars.,2018-09-04T21:00:38+0000
"Mother’s Day review – gut-wrenchingly hard to watch, but hugely inspiring",4 out of 5 stars.,2018-09-03T21:30:09+0000
Vanity Fair review – this adaptation fizzes with all the energy of its social-climbing heroine,4 out of 5 stars.,2018-09-02T21:05:33+0000
Ozark: season 2 review – Netflix's backwoods-noir crime tale returns with more moral murk,3 out of 5 stars.,2018-08-31T05:00:17+0000
"Our Everest Challenge review – Ben Fogle, Victoria Pendleton and some vertiginous cliches",3 out of 5 stars.,2018-08-30T21:02:06+0000
Horizon: A Week Without Lying – The Honesty Experiment review – a social experiment that was bound to fail,3 out of 5 stars.,2018-08-29T21:00:37+0000
The Great British Bake Off review – triumphant return for TV’s own form of comfort food,5 out of 5 stars.,2018-08-28T20:15:20+0000
"Drinkers Like Me – Adrian Chiles review: the complicated, conflicted world of boozing",4 out of 5 stars.,2018-08-27T21:00:04+0000
The Innocents review – confessions of a teenage shapeshifter,3 out of 5 stars.,2018-08-25T05:30:36+0000
Grayson Perry: Rites of Passage review – how to create your very own death ritual,5 out of 5 stars.,2018-08-23T22:00:05+0000
"Horizon: Stopping Male Suicide review – thoughtful, sensitive and powerful",5 out of 5 stars.,2018-08-22T20:59:24+0000
Manhunting With My Mum review – a search for identity ... and a husband,4 out of 5 stars.,2018-08-21T22:00:39+0000
Dwarfs in Art: A New Perspective review – a compelling reappraisal of the overlooked and undervalued,Published: ,2018-08-20T21:00:55+0000
Eight Go Rallying: The Road to Saigon review – Noel Edmonds’ grumble in the jungle,3 out of 5 stars.,2018-08-19T21:00:29+0000
"Searching for Mum: Sri Lanka review – honest, brave and deeply moving",4 out of 5 stars.,2018-08-16T21:00:16+0000
9-1-1 review – Ryan Murphy's life-saving drama is in need of resuscitation,2 out of 5 stars.,2018-08-16T09:35:06+0000
,,
A Passage to Britain review – Who Do You Think You Are? for the empire,4 out of 5 stars.,2018-08-14T21:00:11+0000
Mark Gatiss on John Minton: The Lost Man of Art review – a poignant portrait,4 out of 5 stars.,2018-08-13T21:00:42+0000
"Lost Boys? What’s Going Wrong For Asian Men review – informed, thorough and full of answers",4 out of 5 stars.,2018-08-12T22:50:14+0000
The New Wife review – a hellish reunion for one man and his exes,1 out of 5 stars.,2018-08-10T05:00:28+0000
Hang Ups review – Stephen Mangan improv comedy is glorious TV therapy,4 out of 5 stars.,2018-08-08T21:30:08+0000
The Foreign Doctors Are Coming review – fertile ground for charming eccentricity,4 out of 5 stars.,2018-08-07T22:05:03+0000
Versailles review – if only they’d spent the budget on script editors,Published: ,2018-08-06T21:00:48+0000
Flying Across Britain with Arthur Williams review – the sky’s the limit for aviation enthusiasts,4 out of 5 stars.,2018-08-05T20:00:18+0000
Cuckoo season four review – the further flights of fancy of Ken and Dale,3 out of 5 stars.,2018-08-04T05:30:31+0000
