Title,Stars,DateTime
"I’m With the Band: Nasty Cherry review – move over Simon Cowell, here's Charli XCX!",3 out of 5 stars.,2019-11-15T06:30:00+0000
,,
Climategate: Science of a Scandal review – the hack that cursed our planet,4 out of 5 stars.,2019-11-14T22:00:01+0000
Britain’s Child Drug Runners review – devastating tales of 'modern slavery',5 out of 5 stars.,2019-11-13T23:00:22+0000
Gold Digger review – the twisty toyboy thriller that will get everyone talking,4 out of 5 stars.,2019-11-12T22:00:04+0000
"The Secrets of Amazon review – Alexa, why are you so disturbing?",3 out of 5 stars.,2019-11-11T20:30:19+0000
The Unremembered: Britain’s Forgotten War Heroes review – David Lammy condemns a shameful history,4 out of 5 stars.,2019-11-10T23:01:48+0000
"Green Eggs and Ham review – I'm a huge fan, I am I am!",5 out of 5 stars.,2019-11-08T06:00:38+0000
Britannia season two review – the Roman romp so radical it must be revered,4 out of 5 stars.,2019-11-07T22:01:09+0000
The Devil Next Door review – murderous Nazi or victim of mistaken identity?,3 out of 5 stars.,2019-11-06T17:17:14+0000
Rich Hall’s Red Menace review – down with the nuclear nitwits!,4 out of 5 stars.,2019-11-05T22:30:08+0000
The End of the F***ing World review – coal-black comedy makes a killer return,5 out of 5 stars.,2019-11-04T22:55:36+0000
"The Crown season three, first look review – Olivia Colman spreads regal rage on toast",4 out of 5 stars.,2019-11-04T16:00:05+0000
His Dark Materials review – a riveting realisation of Philip Pullman's magic,5 out of 5 stars.,2019-11-03T21:00:04+0000
The Young Offenders review – craic-filled comedy has the pluck of the Irish,4 out of 5 stars.,2019-11-03T11:00:19+0000
The Morning Show review – Jennifer Aniston returns in a masterwork for the #MeToo era,5 out of 5 stars.,2019-11-01T06:00:26+0000
How Europe Stole My Mum review – nothing short of a Brexit miracle,5 out of 5 stars.,2019-11-01T00:10:11+0000
For All Mankind review – Apple's solid alt-space saga avoids crash landing,3 out of 5 stars.,2019-10-31T16:01:37+0000
"The World According to Putin review – sex, lies and state-approved videotape",4 out of 5 stars.,2019-10-30T23:00:04+0000
The Great British Bake Off final review – even Paul Hollywood couldn't bear it,3 out of 5 stars.,2019-10-29T21:20:06+0000
Dickinson review – Emily Dickinson reborn as a Lizzo-loving feminist,2 out of 5 stars.,2019-10-29T17:49:06+0000
,,
"Who Are You Calling Fat? review – pride, prejudice and gastric bands",4 out of 5 stars.,2019-10-28T22:00:01+0000
"See review – Jason Momoa guts people for fun in Apple TV+'s lethal, sensual saga",4 out of 5 stars.,2019-10-28T13:39:49+0000
It’s Grime Up North review – snide doc reduces regional rap to a punchline,2 out of 5 stars.,2019-10-27T23:05:31+0000
"Seven Worlds, One Planet review – breathtaking, moving, harrowing",5 out of 5 stars.,2019-10-27T19:15:25+0000
"K-Pop Idols: Inside the Hit Factory review – blood, sweat and hair dye",3 out of 5 stars.,2019-10-25T21:30:34+0000
The Accident review – echoes of Grenfell in devastating disaster drama,4 out of 5 stars.,2019-10-24T21:00:06+0000
"Daybreak review – teen zombie apocalypse is a lazy, gory mess",2 out of 5 stars.,2019-10-24T13:08:05+0000
Warrior Women With Lupita Nyong’o review – a kick-ass tale worthy of an Oscar,4 out of 5 stars.,2019-10-23T22:05:50+0000
The British Tribe Next Door review – why did no one put a stop to this?,1 out of 5 stars.,2019-10-22T21:15:15+0000
Watchmen review – the perfect superhero story for our tattered times,4 out of 5 stars.,2019-10-21T21:10:42+0000
Looking for Alaska review – is this Dawson's Creek throwback too wholesome for Gen Z?,3 out of 5 stars.,2019-10-19T10:00:24+0000
"Modern Love review – vapid, nauseating ... and that's before Ed Sheeran shows up",2 out of 5 stars.,2019-10-18T11:56:20+0000
Living With Yourself review – are two Paul Rudds better than one?,3 out of 5 stars.,2019-10-18T05:01:00+0000
Giri/Haji review – Kelly Macdonald crime show is all killer and no thriller,3 out of 5 stars.,2019-10-17T21:00:38+0000
"Limetown review: a load of sub X-Files, podcast-to-TV tosh. Thanks Facebook!",2 out of 5 stars.,2019-10-16T20:00:27+0000
Lenny Henry’s Race Through Comedy review – Britain's blackface shame,3 out of 5 stars.,2019-10-15T21:00:06+0000
Treadstone review – fast-paced Bourne series is a surprise success,3 out of 5 stars.,2019-10-15T06:00:45+0000
Dublin Murders review – a breathless whodunnit with more dread by the minute,3 out of 5 stars.,2019-10-14T21:00:29+0000
Inside the Cage: The Rise of Female Fighters review – bloody battles for cash and glory,3 out of 5 stars.,2019-10-13T10:00:06+0000
Million Dollar Wedding Planner review – the woman who makes brides walk on water,4 out of 5 stars.,2019-10-10T21:00:30+0000
Rhythm + Flow review – Cardi B proves there's life in the TV talent show yet,4 out of 5 stars.,2019-10-09T16:00:15+0000
Doing Drugs for Fun? review – the true horrors of cocaine revealed,4 out of 5 stars.,2019-10-08T22:05:33+0000
"I Love You, Now Die review – twisting truth behind a true-crime shocker",5 out of 5 stars.,2019-10-06T21:15:31+0000
Raising Dion review – seven-year-old superhero is a cereal thriller,3 out of 5 stars.,2019-10-04T06:00:21+0000
Catherine the Great review – Mirren's labour of love lacks the magic touch,3 out of 5 stars.,2019-10-03T21:00:58+0000
RuPaul's Drag Race UK review – so smutty even Ru can't keep up,4 out of 5 stars.,2019-10-03T20:00:55+0000
,,
Living Undocumented review – the families ripped apart by zero-tolerance Trump,5 out of 5 stars.,2019-10-02T14:19:55+0000
What Britain Buys and Sells in a Day review – starvation rations here we come!,4 out of 5 stars.,2019-09-30T21:00:23+0000
World on Fire review – ordinary lives caught up in extraordinary times,4 out of 5 stars.,2019-09-29T21:00:48+0000
Transparent: Musicale Finale review – gloriously close to the bone,5 out of 5 stars.,2019-09-27T05:00:49+0000
The Politician review – Ryan Murphy's student politics show is a born winner,5 out of 5 stars.,2019-09-27T05:00:36+0000
Frayed review – Aussie black comedy is like a nightmare on Ramsay Street,3 out of 5 stars.,2019-09-26T22:00:14+0000
Churchill and the Movie Mogul review – how a tight-trousered Nelson smashed the Nazis,4 out of 5 stars.,2019-09-25T21:00:42+0000
Love in the Countryside review – a dating show as hot as a stoked-up Aga,4 out of 5 stars.,2019-09-24T21:00:08+0000
The $50m Art Swindle review – I feel conned by this Thomas Crown-on-steroids affair,3 out of 5 stars.,2019-09-23T21:30:42+0000
Tories at War review – Spud-U-Hate and the elite potato blight,3 out of 5 stars.,2019-09-22T22:00:11+0000
When life was so sweet in Bournville,Published: ,2019-09-22T17:02:08+0000
"Criminal review – like Line of Duty at its intense, interrogatory best",4 out of 5 stars.,2019-09-20T05:30:54+0000
"The Cameron Years review – no honesty, no remorse ... no forgiveness?",3 out of 5 stars.,2019-09-19T21:00:42+0000
"Japan with Sue Perkins review – cute, candid ... and heavy on the cliches",3 out of 5 stars.,2019-09-18T21:00:11+0000
Defending the Guilty review – a cross between The Thick of It and This Life,3 out of 5 stars.,2019-09-17T21:30:39+0000
Crime and Punishment review – a damning look at our desperate prison system,5 out of 5 stars.,2019-09-16T21:00:10+0000
Inside Cadbury: Chocolate Secrets Unwrapped review – sickeningly dull,2 out of 5 stars.,2019-09-15T20:00:35+0000
"Unbelievable review – grimly credible story of trauma, power and injustice",4 out of 5 stars.,2019-09-13T14:05:44+0000
"Top Boy review – more violent, more gripping, more shocking than ever",4 out of 5 stars.,2019-09-13T06:00:17+0000
,,
Jesy Nelson: Odd One Out review – a modern fairytale in reverse,4 out of 5 stars.,2019-09-12T21:00:03+0000
The I-Land review – Netflix's castaway thriller is not a spoof. It really is this bad,1 out of 5 stars.,2019-09-12T15:17:20+0000
Mrs Fletcher review – Kathryn Hahn charms in thought-provoking comedy,4 out of 5 stars.,2019-09-11T21:37:32+0000
Raiders of the Lost Past review – glorious TV to see you through the End Times,4 out of 5 stars.,2019-09-11T21:00:35+0000
Suicidal review – a deeply harrowing look at a hidden epidemic,4 out of 5 stars.,2019-09-10T21:45:58+0000
Supermarket Sweep review – as stiff as a frozen potato waffle,2 out of 5 stars.,2019-09-09T20:00:24+0000
"State of the Union review: a brutal, tender and perfectly curated portrayal of marriage",5 out of 5 stars.,2019-09-08T21:20:51+0000
The Spy review – Sacha Baron Cohen goes undercover in middling Mossad drama,3 out of 5 stars.,2019-09-06T12:51:13+0000
The Loudest Voice review – portrait of a monster that misses the bigger story,2 out of 5 stars.,2019-09-05T22:00:20+0000
The Big Hospital Experiment review – can a volunteer army save the NHS?,4 out of 5 stars.,2019-09-04T21:00:45+0000
The Capture review – chillingly real thriller or utter bobbins? Let's check the tape,3 out of 5 stars.,2019-09-03T21:00:06+0000
"A Confession review – a profoundly sad drama about suffering, strength and justice",4 out of 5 stars.,2019-09-02T21:00:36+0000
Untouchable: the Rise and Fall of Harvey Weinstein review – films like this change the world,5 out of 5 stars.,2019-09-01T21:35:28+0000
The Dark Crystal: Age of Resistance review – puppet fantasy is purely for the fans,3 out of 5 stars.,2019-08-31T14:46:04+0000
Carnival Row review – Orlando Bloom has it away with the fairies,2 out of 5 stars.,2019-08-30T05:00:28+0000
China: A New World Order review – are we conniving with a genocidal dictatorship?,4 out of 5 stars.,2019-08-29T21:00:04+0000
Cannabis: Miracle Medicine or Dangerous Drug? review – weeding out the truth,4 out of 5 stars.,2019-08-28T21:00:36+0000
"Sink Or Swim review – hugging, learning and the occasional jellyfish",4 out of 5 stars.,2019-08-27T21:30:24+0000
The Great British Bake Off review – sweet relief in these trying times,4 out of 5 stars.,2019-08-27T20:30:22+0000
,,
Poldark final episode review – as gloriously hammy and cheesy as a croque monsieur,4 out of 5 stars.,2019-08-26T21:00:49+0000
Sanditon review – every period drama box is ticked,3 out of 5 stars.,2019-08-25T21:00:21+0000
Peaky Blinders series five review – business as usual for the behatted Brummie gangsters,3 out of 5 stars.,2019-08-25T21:00:21+0000
Mortimer and Whitehouse: Gone Fishing review – they've caught a real beauty,5 out of 5 stars.,2019-08-23T19:30:19+0000
Brassic review – a tale of northern ne’er-do-wells with humour and heart to spare,4 out of 5 stars.,2019-08-22T22:00:53+0000
Train Your Baby Like a Dog review – dehumanising and indefensible,1 out of 5 stars.,2019-08-20T20:00:48+0000
The Day Mountbatten Died review – an atrocity that still haunts lives four decades on,4 out of 5 stars.,2019-08-19T21:00:19+0000
Sports Direct: Secrets of the Mega Sports Factory review – multiple Mike Ashleys? My worst nightmare,4 out of 5 stars.,2019-08-18T20:00:21+0000
Mindhunter season two review – still TV's classiest guilty pleasure,4 out of 5 stars.,2019-08-16T13:17:06+0000
Man vs Wild with Bear Grylls and PM Modi review – the most tasteless TV ever,1 out of 5 stars.,2019-08-15T23:05:59+0000
Deep Water review – it's Britain's answer to Big Little Lies,3 out of 5 stars.,2019-08-14T21:00:23+0000
Kathy Burke's All Woman review – beauty tips from the nation's bluntest nana,3 out of 5 stars.,2019-08-13T22:00:59+0000
"Succession season 2 review – chilling, despicable and horribly addictive",5 out of 5 stars.,2019-08-12T21:10:24+0000
The Queen's Lost Family review – oddly comforting royal history by numbers,3 out of 5 stars.,2019-08-11T20:00:54+0000
"This Way Up review – the worse things get, the better the jokes become",5 out of 5 stars.,2019-08-08T21:35:27+0000
"Jade: The Reality Star Who Changed Britain review – tears, tabloids and a modern fairytale",4 out of 5 stars.,2019-08-07T21:05:58+0000
Euphoria review – so explicit it makes Skins look positively Victorian,4 out of 5 stars.,2019-08-06T22:04:30+0000
Born Famous: Gordon Ramsay review – a taste of reality for the chef's son,2 out of 5 stars.,2019-08-05T22:01:04+0000
Can you Beat the Bookies? review – final proof gambling is a mug's game,4 out of 5 stars.,2019-08-04T20:00:28+0000
Fosse/Verdon review – scenes from a toxic marriage of musical equals,3 out of 5 stars.,2019-08-02T21:40:30+0000
Britain’s Giant Pet Food Factory review – catty in all the wrong ways,2 out of 5 stars.,2019-08-01T21:00:02+0000
Der Pass review – Quick! There’s been a death on the dullest border in Europe!,3 out of 5 stars.,2019-07-31T20:56:29+0000
The Chef’s Brigade review – a cookery challenge worthy of Willy Wonka,3 out of 5 stars.,2019-07-30T21:00:29+0000
How to Break into the Elite review – our prejudiced society in action,3 out of 5 stars.,2019-07-29T21:00:07+0000
"Cindy Sherman #untitled review – love, death, ageing and parrots",4 out of 5 stars.,2019-07-28T21:05:23+0000
The Boys review – sick of superheroes? Here's the remedy,4 out of 5 stars.,2019-07-26T08:00:16+0000
Four Weddings and a Funeral review – is it a remake? I hadn't noticed,3 out of 5 stars.,2019-07-26T06:00:12+0000
Four Weddings and a Funeral review – is it a remake? I hadn't noticed,3 out of 5 stars.,2019-07-26T06:00:12+0000
"TV tonight: the birth of punk rock, according to Iggy Pop",Published: ,2019-07-26T05:20:05+0000
Orange Is the New Black final series review – back to its very best,4 out of 5 stars.,2019-07-26T05:00:24+0000
,,
Inside the Bruderhof review – is this a religious stirring I feel?,4 out of 5 stars.,2019-07-25T22:15:09+0000
Animal Babies: First Year on Earth review – maximum adorableness!,4 out of 5 stars.,2019-07-24T21:00:23+0000
"I Am Nicola review – rare, stunning TV about an awful phenomenon",5 out of 5 stars.,2019-07-23T22:00:06+0000
Keeping Faith series two review – return of the mac!,4 out of 5 stars.,2019-07-23T21:00:06+0000
Who Do You Think You Are? review – Harry Potter and the diamond heist,4 out of 5 stars.,2019-07-22T21:00:36+0000
"Muzlamic review – hit and miss? Maybe, but it's the comedy we need right now",3 out of 5 stars.,2019-07-22T06:00:25+0000
"A Cut Too Far? Male Circumcision review – an act of love, or an assault?",4 out of 5 stars.,2019-07-18T22:23:42+0000
GameFace review – irresistible comedy that's all heart and silliness,4 out of 5 stars.,2019-07-17T21:35:06+0000
Inside the Social Network: Facebook’s Difficult Year review – thumbs down!,2 out of 5 stars.,2019-07-16T21:00:36+0000
Nadiya's Time to Eat review – guilt-free meals in six picoseconds!,3 out of 5 stars.,2019-07-15T19:30:07+0000
Louis Theroux: Surviving America’s Most Hated Family review – a deeply uncomfortable watch,4 out of 5 stars.,2019-07-14T21:00:38+0000
Poldark final series review: still ridiculous – but I wouldn't have it any other way,4 out of 5 stars.,2019-07-14T21:00:37+0000
,,
Harlots season three review – smutty sex-trade drama is a feminist triumph,4 out of 5 stars.,2019-07-12T08:00:22+0000
Mad Cow Disease: The Great British Beef Scandal review – is it really gone for good?,4 out of 5 stars.,2019-07-11T21:00:07+0000
Generation Porn review – trapped in the valley of sex,2 out of 5 stars.,2019-07-10T22:00:38+0000
Cyclists: Scourge of the Streets? review – a road-rage rant dressed in Lycra,2 out of 5 stars.,2019-07-09T21:15:06+0000
Dark Money review – a child abuse drama that is slight but horribly real,3 out of 5 stars.,2019-07-08T21:00:34+0000
"War in the Blood review – love, hope and the search for a cancer cure",5 out of 5 stars.,2019-07-07T21:45:03+0000
"Shipmates review – a ghastly tableau of sun, sex and swollen genitals",1 out of 5 stars.,2019-07-06T05:00:16+0000
"Anna: The Woman Who Went To Fight Isis review – a daughter's bravery, a family's guilt",4 out of 5 stars.,2019-07-03T21:30:28+0000
Britain’s Next Air Disaster? Drones review – the threat is terrifyingly real,3 out of 5 stars.,2019-07-01T21:30:07+0000
"John McEnroe: Still Rockin’ at 60 review – everybody loves him these days. Well, almost everybody",3 out of 5 stars.,2019-06-30T22:30:30+0000
"Bruce Lee and the Outlaw review – brutal, beautiful portrait of a Romanian street kid",5 out of 5 stars.,2019-06-28T21:55:31+0000
Psychopath With Piers Morgan review – this was more about Morgan than the murderer,2 out of 5 stars.,2019-06-28T07:00:14+0000
Emily Atack: Adulting review – proof that the ladette is back,1 out of 5 stars.,2019-06-27T05:00:08+0000
Drag SOS review – can glitter and kindness change lives?,3 out of 5 stars.,2019-06-25T22:00:26+0000
The Unwanted: The Secret Windrush Files review – who could feel proud of Britain after this?,5 out of 5 stars.,2019-06-24T21:00:23+0000
Beecham House review – one man and his beard try to save India,1 out of 5 stars.,2019-06-23T21:05:53+0000
Dark season two review – wilfully confusing and deliciously creepy,4 out of 5 stars.,2019-06-21T08:00:39+0000
Philip Green & the Trouble With Topshop review – ignoring the real scandal,1 out of 5 stars.,2019-06-20T22:05:24+0000
"Catch-22 review – lovely to look at, with a fine cast … but there’s a catch",3 out of 5 stars.,2019-06-20T21:00:22+0000
,,
The Restaurant That Makes Mistakes review – TV to prompt waves of feelings,4 out of 5 stars.,2019-06-19T21:00:50+0000
"Years and Years finale review – fast, furious and frequently devastating",4 out of 5 stars.,2019-06-18T21:00:03+0000
Ackley Bridge review – carry on screaming: the school drama is back,3 out of 5 stars.,2019-06-18T20:00:03+0000
Thatcher: A Very British Revolution review – the Iron Lady's downfall in compelling detail,4 out of 5 stars.,2019-06-17T21:00:36+0000
"Top Gear review – gentler, kinder and all the better for it",4 out of 5 stars.,2019-06-16T20:00:02+0000
I Can Go for That: The Smooth World of Yacht Rock review – lushly comforting,4 out of 5 stars.,2019-06-14T21:00:03+0000
Euphoria review – dizzying high school drama is one of year's best,4 out of 5 stars.,2019-06-14T06:00:09+0000
Who Should Get to Stay in the UK review – the harsh reality of immigration,4 out of 5 stars.,2019-06-13T21:00:04+0000
Wild Bill review – why is Rob Lowe fighting crime in Lincolnshire? Search me,3 out of 5 stars.,2019-06-12T21:00:53+0000
What’s My Name: Muhammad Ali review – from prodigy to legend,4 out of 5 stars.,2019-06-11T21:50:21+0000
Year of the Rabbit review – silly and gleefully sweary ... but where were the gags?,3 out of 5 stars.,2019-06-10T21:30:17+0000
Big Little Lies season two review – it's the Meryl Streep show now,4 out of 5 stars.,2019-06-10T15:06:52+0000
"Killing Eve season 2 review – as stylish, sexy and sociopathic as ever",4 out of 5 stars.,2019-06-08T21:00:07+0000
Pregnant and Platonic review – what's it like to have a baby with a stranger?,3 out of 5 stars.,2019-06-08T10:50:06+0000
"Tales of the City review – a queer classic returns, flawed but often fabulous",3 out of 5 stars.,2019-06-07T11:00:54+0000
My Gay Dog and Other Animals review – this hump-filled hour is a real slog,2 out of 5 stars.,2019-06-06T21:05:44+0000
Mouche review – French remake of Fleabag gets lost in translation,3 out of 5 stars.,2019-06-06T11:22:17+0000
,,
The Virtues finale review – a drama so emotional it left you gasping for air,5 out of 5 stars.,2019-06-05T21:40:37+0000
"Black Mirror season five review – sweet, sadistic and hugely impressive",4 out of 5 stars.,2019-06-05T11:00:09+0000
"Chernobyl finale review – when the dust settles, it will be considered a classic",5 out of 5 stars.,2019-06-04T21:10:09+0000
63 Up review – documentary marvel makes all other reality TV look trivial,4 out of 5 stars.,2019-06-04T21:00:08+0000
The Truth About Chlorinated Chicken review – an instant appetite-ruiner,4 out of 5 stars.,2019-06-03T19:30:11+0000
Storyville: The Raft review – almost too deliciously ludicrous to be true,4 out of 5 stars.,2019-06-02T21:37:43+0000
When They See Us review – Netflix's gut-wrenching tale of the Central Park Five,4 out of 5 stars.,2019-05-31T08:00:27+0000
Good Omens review – Sheen and Tennant fight the devil with dill sauce,3 out of 5 stars.,2019-05-31T05:00:34+0000
Crisis in Care: Who Cares? review – the horrors of austerity laid bare,4 out of 5 stars.,2019-05-29T21:00:12+0000
The Planets review – so staggering you go ‘whoa!’ every few seconds,4 out of 5 stars.,2019-05-28T21:00:22+0000
A Very British Sex Shop review – behind the scenes of a dildo dynasty,3 out of 5 stars.,2019-05-27T21:00:12+0000
"Equator from the Air review – the havoc humans wreak on nature, seen from the sky",3 out of 5 stars.,2019-05-26T20:00:20+0000
"The Other Two review – a fabulous, scabrous sendup of Bieber-a-likes",5 out of 5 stars.,2019-05-23T22:00:14+0000
Summer of Rockets review – Poliakoff has pulled it off at last!,4 out of 5 stars.,2019-05-22T21:00:22+0000
Hot Property review – it's Through the Keyhole meets Blind Date,3 out of 5 stars.,2019-05-21T22:00:12+0000
Hatton Garden review – if only the real robbery had this attention to detail,4 out of 5 stars.,2019-05-20T21:00:20+0000
What We Do In the Shadows review – the undead prove dead funny,4 out of 5 stars.,2019-05-19T21:35:15+0000
Gentleman Jack review: Suranne Jones rocks Halifax as the first modern lesbian,4 out of 5 stars.,2019-05-19T21:00:14+0000
"Puppy School review – cute, but less jeopardy than a Bake Off highlights reel",3 out of 5 stars.,2019-05-17T20:00:15+0000
David Harewood: Psychosis and Me review – breathtakingly honest,4 out of 5 stars.,2019-05-16T21:00:44+0000
Mum review – magnificent TV that will put sunshine in your heart,5 out of 5 stars.,2019-05-15T21:30:15+0000
The Virtues review – a harrowing triumph by Shane Meadows,5 out of 5 stars.,2019-05-15T21:00:14+0000
,,
Years and Years review – a glorious near-future drama from Russell T Davies,5 out of 5 stars.,2019-05-14T21:00:44+0000
One Day in Gaza review – an almost unwatchably vivid vision of carnage,4 out of 5 stars.,2019-05-13T21:00:14+0000
15 Days review – a deeply satisfying Welsh farmhouse murder mystery,4 out of 5 stars.,2019-05-13T21:00:14+0000
TV tonight: it's time for the last war in Game of Thrones,Published: ,2019-05-13T05:20:03+0000
"Mothers on the Edge review – Louis Theroux, more perturbed than ever before",4 out of 5 stars.,2019-05-12T21:01:42+0000
Pose finale review – a razzle-dazzle spectacle of pure infectious joy,4 out of 5 stars.,2019-05-09T21:00:10+0000
"Taskmaster review – a cheap, childish comedy miracle",4 out of 5 stars.,2019-05-08T21:00:21+0000
Chernobyl review – chaos reigns in confusing nuclear disaster epic,3 out of 5 stars.,2019-05-07T21:00:06+0000
Sex on Trial review – a story of nightmarish twists and turns,4 out of 5 stars.,2019-05-06T22:05:22+0000
Blind Date review – was love in the air on the first ever bisexual episode?,3 out of 5 stars.,2019-05-05T20:00:05+0000
"Dead to Me review – come back Desperate Housewives, all is forgiven!",2 out of 5 stars.,2019-05-03T11:00:39+0000
Tuca and Bertie review – Bojack’s deliciously twisted cousins take flight,4 out of 5 stars.,2019-05-03T07:00:35+0000
Our Dementia Choir With Vicky McClure review – your tears will flow unstoppably,4 out of 5 stars.,2019-05-02T20:00:19+0000
Forensics: The Real CSI review – the antidote to tawdry true crime,3 out of 5 stars.,2019-05-01T21:00:05+0000
Bake Off: The Professionals review – an infuriating imitation of the real thing,2 out of 5 stars.,2019-04-30T20:00:27+0000
The Curry House Kid review – Akram Khan’s memories of serving drunk white racists,5 out of 5 stars.,2019-04-29T22:05:18+0000
Hostile Planet review – a heartstopping look at wildlife on the edge,4 out of 5 stars.,2019-04-28T21:00:28+0000
Chambers review – not even Uma Thurman can save this supernatural slog,2 out of 5 stars.,2019-04-26T10:00:16+0000
Bobby the banged-up bank robber steals the show – Happy Birthday OU review,3 out of 5 stars.,2019-04-25T21:00:01+0000
Bonding review – learn how to be a dominatrix (in under three hours),4 out of 5 stars.,2019-04-24T11:00:19+0000
Surgeons: At the Edge of Life review – Warning: not for the faint of heart!,4 out of 5 stars.,2019-04-23T21:00:03+0000
Back to Life review – this darkly comic gem is an ideal Fleabag replacement,5 out of 5 stars.,2019-04-22T21:55:32+0000
"The Importance of Being Oscar review – the life of Wilde, warts and all",3 out of 5 stars.,2019-04-20T21:30:36+0000
"Lunatics review – thankfully no blackface, but still painfully unfunny",1 out of 5 stars.,2019-04-19T11:01:26+0000
"Climate Change: The Facts review – our greatest threat, laid bare",5 out of 5 stars.,2019-04-18T21:00:37+0000
Earth from Space review – hold on to your tinfoil hats!,4 out of 5 stars.,2019-04-17T21:00:09+0000
Chimerica review – a thrillingly real drama about fake news,5 out of 5 stars.,2019-04-17T21:00:07+0000
,,
The Great British School Swap review – racial harmony? It's child's play,3 out of 5 stars.,2019-04-16T21:00:01+0000
The Massacre That Shook the Empire review – brutal truth of colonial India,4 out of 5 stars.,2019-04-13T20:59:29+0000
Just One Night review – a dating show so awful you’ll be screaming in agony,2 out of 5 stars.,2019-04-12T14:00:02+0000
Naked Beach review – want to boost your body image? Get your kit off!,3 out of 5 stars.,2019-04-11T20:00:29+0000
Don't Forget the Driver review – the refugee crisis hits Bognor in superb sadcom,4 out of 5 stars.,2019-04-09T21:30:31+0000
"The Victim review – grab a drink and settle in for a gripping, vicious thriller",4 out of 5 stars.,2019-04-08T21:00:03+0000
The Durrells review – a welcome vacation from our island of nightmares,4 out of 5 stars.,2019-04-07T20:00:29+0000
