Title,Stars,DateTime
Succession review – brilliant dissection of a dysfunctional dynasty,5 out of 5 stars.,2018-08-02T21:15:30+0000
"The UN Sex Abuse Scandal review – careful, dignified and gruelling",5 out of 5 stars.,2018-08-01T22:31:02+0000
Age Before Beauty review – a personal pamper party of escapism,3 out of 5 stars.,2018-07-31T21:00:31+0000
Whoever Heard of a Black Artist? Britain’s Hidden Art History review – a powerful picture of whitewashing,4 out of 5 stars.,2018-07-30T21:00:36+0000
Travels in Trumpland with Ed Balls review – a Lycra-clad quest to understand the US,4 out of 5 stars.,2018-07-29T21:00:08+0000
Orange Is the New Black season six review – taking it to the Max for a plot refresh,3 out of 5 stars.,2018-07-28T05:30:21+0000
The Big Life Fix review – can tech hipsters help a disabled man snowboard again?,4 out of 5 stars.,2018-07-26T20:00:46+0000
The Bletchley Circle: San Francisco review – period drama spin-off is admirably awful,1 out of 5 stars.,2018-07-25T21:05:18+0000
Mark Kermode’s Secrets of Cinema review – how Wallace and Gromit inspired Tom Cruise,4 out of 5 stars.,2018-07-24T21:00:53+0000
Storyville: Insha’Allah Democracy review – pulls its punches... but better than Morgan v Trump,3 out of 5 stars.,2018-07-23T22:15:45+0000
"Artist in Residence: Sex Clinic review – very informative, and not just about down there",3 out of 5 stars.,2018-07-22T22:05:16+0000
Suits review – Meghan Markle’s out but Katherine Heigl comes in as the daftly addictive show goes on,3 out of 5 stars.,2018-07-20T07:00:00+0000
Our Shirley Valentine Summer review – Love Island for celebrity fiftysomethings,2 out of 5 stars.,2018-07-19T21:00:48+0000
Killed By My Debt – a sad true story turned into a compelling family tragedy,4 out of 5 stars.,2018-07-18T21:00:26+0000
The Five Billion Pound Super Sewer review – inside London’s battle against the Great Stink,3 out of 5 stars.,2018-07-17T21:00:16+0000
Who Is America? review – too frightening to be truly funny,3 out of 5 stars.,2018-07-16T21:40:47+0000
Unforgotten series three review – TV’s most likable detective duo is back,5 out of 5 stars.,2018-07-15T21:00:18+0000
Keeping Faith review – a brilliant Welsh answer to Broadchurch,3 out of 5 stars.,2018-07-12T21:00:51+0000
"Picnic at Hanging Rock review – as mysterious as the film, but bigger in every way",4 out of 5 stars.,2018-07-11T21:00:22+0000
"The Rise and Fall of Nokia review – fascinating insight into the Finnish, and now finished, tech firm",3 out of 5 stars.,2018-07-10T20:59:53+0000
Sharp Objects review – the new Big Little Lies? It’s much better than that,4 out of 5 stars.,2018-07-09T21:15:24+0000
Strokes of Genius: Federer v Nadal review – revisiting the greatest tennis match ever,4 out of 5 stars.,2018-07-08T19:00:08+0000
"Keith Lemon: Coming in America review – unrelentingly awful but very, very funny",3 out of 5 stars.,2018-07-05T21:50:09+0000
Rich Hall’s Working for the American Dream review – Sigmund Freud in a cowboy hat,4 out of 5 stars.,2018-07-04T21:30:13+0000
Nailed It! review – a comedy baking show that revels in disaster,3 out of 5 stars.,2018-07-04T05:00:21+0000
,,
The NHS: A People’s History review – Britain at its best and its worst,4 out of 5 stars.,2018-07-02T21:00:19+0000
The Misadventures of Romesh Ranganathan review – high alert in Haiti,3 out of 5 stars.,2018-07-01T21:00:50+0000
The Bridge series finale review – goodbye Saga Norén. God we'll miss you,5 out of 5 stars.,2018-06-30T05:30:02+0000
Japan’s Secret Shame review - breaking a nation’s taboo about rape,Published: ,2018-06-28T21:00:18+0000
Stath Lets Flats review – finding the funny in generation rent’s plight,3 out of 5 stars.,2018-06-27T21:30:50+0000
The Affair series 4 review – a return to form for those who are still watching,Published: ,2018-06-26T21:10:20+0000
Britain’s Best Junior Doctors review – celebrating the NHS with a quiz,3 out of 5 stars.,2018-06-25T19:00:08+0000
Reporting Trump’s First Year: The Fourth Estate – heroism in these dark days,5 out of 5 stars.,2018-06-24T21:00:42+0000
Unsung Heroines: Danielle de Niese on Female Composers review – listen up!,3 out of 5 stars.,2018-06-23T05:30:01+0000
The Murder of Rhys Jones: Police Tapes review – a forensic examination of the efforts to catch a boy’s killer,4 out of 5 stars.,2018-06-21T21:00:09+0000
"Mortimer & Whitehouse: Gone Fishing – a comic reflection on life, mortality and tench",3 out of 5 stars.,2018-06-20T21:32:04+0000
Conviction: Murder in Suburbia review – a perplexing new case for true-crime fans,3 out of 5 stars.,2018-06-19T21:00:22+0000
Rebel Women: The Great Art Fightback review – feminist art versus the patriarchy,4 out of 5 stars.,2018-06-18T22:30:07+0000
Managing England: The Impossible Job review – tracing 52 years of hurt,4 out of 5 stars.,2018-06-17T21:00:24+0000
Flowers review – mental-health comedy blossoms into utter brilliance,4 out of 5 stars.,2018-06-16T05:30:36+0000
The Trouble With Women With Anne Robinson review – borderline farcical,2 out of 5 stars.,2018-06-14T21:02:09+0000
Putin’s Russia with David Dimbleby review – things are different there,4 out of 5 stars.,2018-06-13T21:00:28+0000
"The Terror review – ships, souls and spirits are crushed in the Arctic",4 out of 5 stars.,2018-06-12T22:15:01+0000
Grenfell documentary review – a profoundly moving testament to enduring grief,4 out of 5 stars.,2018-06-11T21:00:30+0000
"Poldark review – a tricky love triangle with passion, politics … and bare chests",4 out of 5 stars.,2018-06-10T21:00:01+0000
Sense8: the series finale review – sci-fi love-in is strictly for the fans,2 out of 5 stars.,2018-06-09T05:31:14+0000
"The Good Fight review – bold end to a risk-taking, Trump-baiting season",5 out of 5 stars.,2018-06-07T21:15:52+0000
Dietland review – a ferocious and funny drama for the #MeToo era,4 out of 5 stars.,2018-06-07T05:00:37+0000
,,
Bride and Prejudice review: guaranteed to expose your inner bigot,3 out of 5 stars.,2018-06-05T21:00:55+0000
Suffragettes with Lucy Worsley review – thrilling tale of women’s fight for rights,5 out of 5 stars.,2018-06-04T21:00:25+0000
"A Very English Scandal finale review – leaves you reeling, seething and laughing",5 out of 5 stars.,2018-06-03T21:01:00+0000
Africa: A Journey Into Music review – Nigeria's rich musical history is examined,4 out of 5 stars.,2018-06-01T22:05:00+0000
"Ambulance review – crews rarely have a quiet Saturday night, but this is off the scale",4 out of 5 stars.,2018-05-31T21:00:30+0000
The Big Crash Diet Experiment review – does dramatic calorie reduction work?,3 out of 5 stars.,2018-05-30T20:00:00+0000
Arrested Development: season five review – offscreen drama mars modest recovery,3 out of 5 stars.,2018-05-29T13:12:44+0000
"King Lear review – Anthony Hopkins is shouty, vulnerable and absolutely mesmerising",4 out of 5 stars.,2018-05-28T22:30:05+0000
"Jonathan Meades on Jargon review – blisteringly brutal, clever and hilarious",4 out of 5 stars.,2018-05-27T22:30:36+0000
"How to Get Fit Fast review – hacking your lunchbox, one tomato at a time",2 out of 5 stars.,2018-05-26T05:00:47+0000
Million Pound Menu review – Dragons’ Den meets Masterchef,3 out of 5 stars.,2018-05-24T21:00:28+0000
Carry on Brussels review – a sorry slice of EU parliament life,4 out of 5 stars.,2018-05-23T22:09:35+0000
Manchester: The Night of the Bomb review – I watched with my heart in my throat,Published: ,2018-05-22T21:00:05+0000
Jamie’s Quick & Easy Food review – stress-free family cooking,3 out of 5 stars.,2018-05-21T19:30:34+0000
The Handmaid’s Tale series 2 review – as intense as TV gets,5 out of 5 stars.,2018-05-20T21:15:07+0000
A Very English Scandal review: funny and confident – like Jeremy Thorpe,5 out of 5 stars.,2018-05-20T21:00:07+0000
,,
Kirsty Young lifts a worthy BBC in battle of the wedding broadcasters,Published: ,2018-05-19T21:00:37+0000
"Humans: season three review – injustice, racism and prejudice. Sound familiar?",4 out of 5 stars.,2018-05-17T21:00:40+0000
What Makes a Woman review – a show that asked extraordinarily complex questions,3 out of 5 stars.,2018-05-16T22:05:11+0000
The Windsors Royal Wedding Special review – gloriously brazen satire,4 out of 5 stars.,2018-05-15T21:00:29+0000
Patrick Melrose review – a brilliant portrayal of addiction,5 out of 5 stars.,2018-05-13T21:10:09+0000
"The Bridge: season four review – ultra violent, bracing but still brilliant",4 out of 5 stars.,2018-05-11T21:00:11+0000
"Safe review – Michael C Hall’s odd, synthetic British accent is symptomatic of this Netflix drama",3 out of 5 stars.,2018-05-11T05:00:34+0000
,,
Taskmaster review – panel game that celebrates the bizarre and the mediocre,Published: ,2018-05-09T21:00:54+0000
One Strange Rock review – Will Smith getting jiggy with planet Earth,1 out of 5 stars.,2018-05-08T21:00:28+0000
Car Share Unscripted review: ad-lib show stalls at the lights,Published: ,2018-05-07T23:14:46+0000
"Genderquake review – raw, funny, brittle and combative",4 out of 5 stars.,2018-05-07T21:00:01+0000
Carnage review – a glorious mashup of Top Gear and Robot Wars,3 out of 5 stars.,2018-05-06T20:00:29+0000
The Rain review – Netflix brings post-apocalyptic thrills to Denmark,4 out of 5 stars.,2018-05-04T05:00:16+0000
Syria: The World’s War review: Lyse Doucet dissects a brutal and misunderstood conflict,Published: ,2018-05-03T21:00:05+0000
Love in the Countryside review – Sara Cox gives farmers a hand finding rural romance,3 out of 5 stars.,2018-05-02T21:00:23+0000
My F-ing Tourette’s Family review: a lovely family – but the boys’ tics are quite something,3 out of 5 stars.,2018-05-01T21:00:04+0000
"Art on the BBC: The Genius of Leonardo da Vinci – the man, his art and his TV career",Published: ,2018-04-30T21:00:22+0000
Netflix's Bobby Kennedy for President review – portrait of an American tragedy,3 out of 5 stars.,2018-04-27T08:31:15+0000
Barry review – A perfect storm of horror and hilarity as Bill Hader's hitman turns actor,4 out of 5 stars.,2018-04-26T22:25:28+0000
Britain’s Fat Fight With Hugh Fearnley-Whittingstall review: mischief with a message,4 out of 5 stars.,2018-04-25T21:00:01+0000
The Split review – Abi Morgan’s shiny lawyers show life in all its wondrous mess,5 out of 5 stars.,2018-04-24T21:01:29+0000
Westworld: season two review – the robot rebellion will be televised,4 out of 5 stars.,2018-04-23T21:20:01+0000
The Woman in White review – the Victorian classic updated for the #MeToo era,4 out of 5 stars.,2018-04-22T21:00:32+0000
The Button review – the latest thing in home entertainment,2 out of 5 stars.,2018-04-21T05:30:05+0000
The Secret Life of the Zoo review – basically Big Brother for the animal world,Published: ,2018-04-20T05:20:13+0000
"True Horror review – a few dead goats, a ghostly old woman and a scary electricity bill, but no terror",Published: ,2018-04-19T22:05:04+0000
Stephen: The Murder That Changed a Nation review – grimly relevant after 25 years,Published: ,2018-04-17T21:00:06+0000
The Queen’s Green Planet review – a right royal conservation effort,3 out of 5 stars.,2018-04-16T21:00:18+0000
My Year With the Tribe review – an ethical quagmire in the Indonesian jungle,3 out of 5 stars.,2018-04-15T21:00:01+0000
Lost in Space review – Netflix's sci-fi reboot takes a small step into the future,3 out of 5 stars.,2018-04-12T23:00:20+0000
Deep State review – Fox tries to follow in Homeland’s well-trodden footsteps,2 out of 5 stars.,2018-04-12T21:00:18+0000
Wild Wild Country review – Netflix’s take on the cult that threatened American life,5 out of 5 stars.,2018-04-11T15:00:01+0000
The Class of Mum and Dad review – it’s back to year 6 for these primary school parents,Published: ,2018-04-10T20:00:38+0000
Secret Agent Selection: WW2 review – are you hard enough to kill for your country?,3 out of 5 stars.,2018-04-09T21:59:09+0000
Jesus’ Female Disciples: The New Evidence – a timely new take on the ultimate boys’ club,3 out of 5 stars.,2018-04-08T20:00:38+0000
The City and the City review – sci-fi meets crime fiction in parallel worlds,3 out of 5 stars.,2018-04-07T05:00:52+0000
Silicon Valley review – Mike Judge’s coding comedy still hits the right keys,Published: ,2018-04-05T22:00:14+0000
First Dates review – series 10 serves up a comforting mix of the lovable and the cringe,4 out of 5 stars.,2018-04-04T22:05:31+0000
"Cunk on Britain review – look out, Philomena’s about",Published: ,2018-04-04T07:47:50+0000
,,
Kiss Me First review – in this ambitious teen drama there’s trouble in digital paradise. Sound familiar?,Published: ,2018-04-02T21:59:21+0000
"The Generation Game review – priapic symbolism and a conveyor belt? Yes, it’s the return of a family favourite",3 out of 5 stars.,2018-04-02T08:13:17+0000
Lee and Dean review – another comedy to watch through your fingers,4 out of 5 stars.,2018-03-31T05:00:04+0000
Indian Summer School review – five terrible teens are sent to India’s equivalent of Eton,3 out of 5 stars.,2018-03-29T21:04:02+0000
Are You Autistic? review – a sorely needed primer,Published: ,2018-03-28T22:09:13+0000
Mum: season two finale review – 'I can’t be the only person who cried',Published: ,2018-03-27T21:30:04+0000
Come Home review – why would a woman walk out on her family?,4 out of 5 stars.,2018-03-27T21:00:03+0000
,,
Russian Spy Assassins: The Salisbury Attack review – as stunning as a le Carré thriller,4 out of 5 stars.,2018-03-26T22:05:01+0000
RAF at 100 with Ewan and Colin McGregor review – a flyby history from the actor and his pilot brother,3 out of 5 stars.,2018-03-25T22:00:12+0000
The Defiant Ones review – Dr Dre's American dream comes vividly to life,5 out of 5 stars.,2018-03-24T06:00:16+0000
Contagion! review – an epidemic of tedium,Published: ,2018-03-22T22:15:37+0000
Zoe Ball’s Hardest Road Home review – a bike ride with a mission and a message,Published: ,2018-03-21T22:00:07+0000
Who Do You Think You Are? USA review – the one where Monica goes in search of her ancestors,3 out of 5 stars.,2018-03-20T22:00:11+0000
The Funeral Murders review – masterful handling of a combustible narrative,Published: ,2018-03-19T22:00:22+0000
"The Durrells review – Keeley Hawes is marvellous in this sunny, undemanding drama",Published: ,2018-03-18T21:00:13+0000
Pilgrimage: The Road to Santiago review – stars put their best feet forward,3 out of 5 stars.,2018-03-16T22:10:05+0000
"Four Days That Shook Britain review – stories of amazing bravery, kindness and humanity in the wake of the UK terrorist attacks",Published: ,2018-03-15T22:30:35+0000
Saving the British Bulldog review – Catherine Tate was seriously worried about our flat-faced friends,4 out of 5 stars.,2018-03-14T10:00:04+0000
Ricky Gervais: Humanity review – Netflix special sees master of provocation settle old scores,3 out of 5 stars.,2018-03-13T11:00:37+0000
Being Blacker review – a family saga that tells the story of an entire community,4 out of 5 stars.,2018-03-12T22:30:24+0000
Sir Bruce: A Celebration review – didn’t they do well,3 out of 5 stars.,2018-03-11T22:05:00+0000
"Putin: The New Tsar review – a portrait of a lonely, lying narcissist",4 out of 5 stars.,2018-03-10T06:30:05+0000
Jessica Jones: season two review – Netflix’s difficult second outing for its mould-breaking superhero,3 out of 5 stars.,2018-03-08T11:49:17+0000
One Born Every Minute review – childbirth needs no added drama,Published: ,2018-03-07T22:00:32+0000
This Country review – return of the sublime Cotswolds mockumentary,5 out of 5 stars.,2018-03-06T23:15:16+0000
Imagine … Philip Pullman review: A master craftsman on the tools of his trade,4 out of 5 stars.,2018-03-05T23:50:28+0000
Churchill’s Secret Affair review – we shall frolic on the beaches,4 out of 5 stars.,2018-03-05T09:53:25+0000
,,
Flint Town review – Netflix's incredible portrait of a town in crisis,5 out of 5 stars.,2018-03-02T06:00:13+0000
Serial Killer with Piers Morgan review – gawping at a psychopath,Published: ,2018-03-01T22:00:31+0000
The Assassination of Gianni Versace review – Ryan Murphy's fashion fable is flawed but fab guilty pleasure,3 out of 5 stars.,2018-02-28T22:00:52+0000
Save Me review – Suranne Jones shines as a grief-stricken mother in a complex mystery,4 out of 5 stars.,2018-02-28T22:00:02+0000
Divorce season two review – ‘Best watched through fingers and a Valium haze’,3 out of 5 stars.,2018-02-27T22:45:00+0000
Classic Mary Berry review – who needs Mel’n’Sue when you have a Swedish caveman?,Published: ,2018-02-26T21:00:26+0000
Strike: Career of Evil review – JK Rowling's PI returns for some red-blooded mail,3 out of 5 stars.,2018-02-26T07:00:07+0000
An Island Parish: After the Hurricane review – battered Anguilla keeps the faith,3 out of 5 stars.,2018-02-24T06:30:07+0000
Young Sheldon review: he’s an irritating little smartypants – but he’s headed for something Big one day,2 out of 5 stars.,2018-02-23T06:00:39+0000
The £1 Houses: Britain’s Cheapest Street review – the home-owning dream is now a nightmare,Published: ,2018-02-22T06:00:10+0000
Mum review – a cliched take on the maddening reality of being a mother,3 out of 5 stars.,2018-02-21T06:00:16+0000
Marcella review – Anna Friel returns in the delightfully tonto crime drama,3 out of 5 stars.,2018-02-20T06:00:16+0000
Mosaic review – Sharon Stone brings icy charisma to Steven Soderbergh’s murder-mystery,4 out of 5 stars.,2018-02-19T06:00:47+0000
Everything Sucks! review – Netflix's high school comedy fails to make the grade,2 out of 5 stars.,2018-02-16T08:00:47+0000
My Wonderful Life review – touching and moving memorials from those about to die,3 out of 5 stars.,2018-02-15T22:00:32+0000
Damned review – pitch black comedy finds the funny in social services,5 out of 5 stars.,2018-02-14T22:30:58+0000
Shetland review - the body count mounts in this stunningly bleak drama,3 out of 5 stars.,2018-02-13T22:00:01+0000
Trauma review – presses our noses up against the window of parental grief,Published: ,2018-02-13T07:00:59+0000
Collateral review – Carey Mulligan shines in a damaging political drama,4 out of 5 stars.,2018-02-12T22:00:25+0000
"Modus review – it’s not The Killing, but a pacy, undemanding thriller",Published: ,2018-02-12T06:00:07+0000
,,
Jamestown review – new settlers make a splash in Virginia,2 out of 5 stars.,2018-02-09T23:15:17+0000
James Bulger: A Mother’s Story review – the pain continues 25 years later,4 out of 5 stars.,2018-02-09T08:43:59+0000
Queer Eye review – Netflix reboot looks beyond the wardrobe to find hidden depths,4 out of 5 stars.,2018-02-07T12:29:31+0000
Flatpack Empire review – Ikea's furniture revolution witnessed from the shop floor,Published: ,2018-02-06T22:00:02+0000
The X-Files review – juddering Mulder and Scully reboot jumps the shark,2 out of 5 stars.,2018-02-05T22:00:05+0000
Endeavour review – as comforting as cheese on toast,Published: ,2018-02-05T06:00:12+0000
Requiem review – heavy on the Hammer horror cliches,3 out of 5 stars.,2018-02-02T22:00:05+0000
Death Row 2018 with Trevor McDonald review – clear-eyed detachment from the veteran journalist,Published: ,2018-02-02T06:00:47+0000
Wonders of the Moon review – a timely celebration of all things lunar,Published: ,2018-02-01T07:00:32+0000
Can You Rebuild My Brain? review –​ ​the cutting edge of ‘brain fixing’,Published: ,2018-01-31T06:01:02+0000
Panorama – Addicted: Last Chance Mums review – powerful but lacking analysis,Published: ,2018-01-30T07:00:14+0000
Chris Packham: In Search of the Lost Girl review – the big picture via a small photograph,Published: ,2018-01-29T06:20:15+0000
The week in TV: Call the Midwife; Grace and Frankie; Will and Grace and more – review,Published: ,2018-01-28T07:00:12+0000
Dirty Money review – Alex Gibney left choking with rage by VW,3 out of 5 stars.,2018-01-27T06:30:42+0000
Stealing Van Gogh review – a fascinating look at ‘the most shocking art crime of the 21st century’,Published: ,2018-01-25T06:00:07+0000
Black Lightning review – Netflix’s grown-up superhero show is a swashbuckling stunner,4 out of 5 stars.,2018-01-24T06:00:22+0000
Panorama – White Fright: Divided Britain review – the people let down by a decade of policy failure,4 out of 5 stars.,2018-01-22T21:00:31+0000
Call the Midwife review – heartstrings are tugged as the nursing drama gets serious,4 out of 5 stars.,2018-01-21T21:00:31+0000
Monty Don’s Paradise Gardens review – a heady tour of earthly delights,3 out of 5 stars.,2018-01-20T06:00:44+0000
Big Cats review – creatures great and small in search of lunch,3 out of 5 stars.,2018-01-19T09:00:19+0000
Britannia review – Jez Butterworth's epic fantasy rules the airwaves,4 out of 5 stars.,2018-01-18T22:30:06+0000
Millionaires’ Ex-Wives Club review – It’s all about the money or is it?,4 out of 5 stars.,2018-01-18T07:33:56+0000
,,
Before We Die review – more than Nordic noir by numbers,4 out of 5 stars.,2018-01-17T00:16:39+0000
Trump Voters – One Year On review: the president’s people offer a bleak vision of the new America,4 out of 5 stars.,2018-01-15T21:00:06+0000
The Coronation review – Queen shines in a surprisingly fun royal coup,4 out of 5 stars.,2018-01-15T07:20:26+0000
The South Bank Show 40th Anniversary review: a punchy celebration of the agenda-setting arts show,3 out of 5 stars.,2018-01-15T06:00:48+0000
"The Wine Show review – like The Trip, minus the existential crises",Published: ,2018-01-13T06:00:50+0000
Transformation Street review – three eloquent case studies discuss changing gender,Published: ,2018-01-12T05:59:21+0000
Hansa Studios: By the Wall 1976-90 review – the most thrillingly creative place on earth,Published: ,2018-01-11T06:00:13+0000
Working Class White Men review – Professor Green finds tales of hope and anger,Published: ,2018-01-10T06:00:40+0000
"Next of Kin review – a brutal family thriller, full of suspicion",Published: ,2018-01-09T07:01:01+0000
"Hard Sun review: an apocalyptic, gutsy drama from the creator of Luther",4 out of 5 stars.,2018-01-06T22:30:05+0000
A House Through Time review – a compelling way to trace social history,Published: ,2018-01-05T07:00:06+0000
Girlfriends review: Kay Mellor introduces a gaggle of women you’d love to know in real life,Published: ,2018-01-04T06:00:06+0000
Inside No 9 review – a gleeful dismemberment of Shakespearean farce,Published: ,2018-01-03T06:00:08+0000
"Sue Perkins and the Chimp Sanctuary review – cruelty, survival and plenty of tears",Published: ,2018-01-02T06:00:19+0000
The Price Is Right review – Alan Carr reboots everyone’s favourite guessing game,Published: ,2018-01-01T06:00:02+0000
Natural World: Attenborough and the Empire of the Ants review – another fascinating insight into the insect world,Published: ,2017-12-29T06:00:22+0000
"Alan Partridge: Why, When, Where, How and Whom? review – Aha! Alan's back on the Beeb",Published: ,2017-12-28T06:00:38+0000
Little Women review – perfect for the onset of Boxing Day choco-torpor,Published: ,2017-12-27T06:59:10+0000
"Call the Midwife Christmas special review – the Big Freeze hits, but the tears keep flowing",Published: ,2017-12-26T06:00:41+0000
Saturday Night Fever: The Ultimate Disco Movie review – Bruno Tonioli hits the floor,Published: ,2017-12-23T06:30:14+0000
"Gordon, Gino and Fred’s Christmas Roast review – a seasonal feast for a good cause",Published: ,2017-12-22T06:00:45+0000
Judi Dench: My Passion for Trees review – from woodland stethoscopes to Shakespeare’s sonnets,Published: ,2017-12-21T07:00:00+0000
Shamed review – revenge is a dish best served by other dramas,Published: ,2017-12-20T06:00:07+0000
The League of Gentlemen review – Royston Vasey: just as terrifying as ever,Published: ,2017-12-19T06:00:18+0000
Alternativity review: Banksy joins Danny Boyle to make Bethlehem cool,Published: ,2017-12-18T06:00:51+0000
Roy Orbison: Love Hurts review – enough tragedy to fill several lifetimes,Published: ,2017-12-16T07:00:55+0000
The Tunnel: Vengeance review – intriguing sleepover kid-swap,Published: ,2017-12-15T07:00:10+0000
Vanished by the Lake review – all the coincidences of a classic French thriller,Published: ,2017-12-14T06:00:23+0000
"The World’s Most Expensive Presents review – a ballgown for your dog, anyone?",Published: ,2017-12-13T07:00:12+0000
Nigella’s Christmas Table review – time for mortals to feel inadequate,Published: ,2017-12-12T06:00:26+0000
John Noakes: TV Hero review – a nostalgic tribute to Blue Peter’s original daredevil,Published: ,2017-12-11T06:00:13+0000
The Grand Tour: season two review – another lap of spectacle and sexism,Published: ,2017-12-08T13:02:22+0000
Storyville: When Rock Arrived in North Korea review – a Slovenian industrial metal band takes Pyongyang,Published: ,2017-12-08T05:59:34+0000
,,
Peaky Blinders review – one of the most daft and thrilling hours of the TV week,Published: ,2017-12-07T06:00:03+0000
Finding Me a Family review: matchmaking children and parents,Published: ,2017-12-06T06:00:09+0000
The Real Marigold on Tour review – Miriam Margolyes and co put the wind up the locals,Published: ,2017-12-05T06:00:08+0000
